ProductName,ProductPrice,ProductDiscount,ProductSold,ProductAddress,ProductReviewCount,Productlink
Bộ Dưỡng Ẩm Mini Chống Lão Hoá Hoa Phong Lan Tím Innisfree Jeju Orchid Special Kit 4 Món- BABICO,90.000,,10,Long An,5,https://www.lazada.vn/products/bo-duong-am-mini-chong-lao-hoa-hoa-phong-lan-tim-innisfree-jeju-orchid-special-kit-4-mon-babico-i1515438245.html
"Sữa rửa mặt Kisson 145ml - Làm sạch sâu từ bề mặt đến chân lông, Gel Rửa Mặt Tinh Chất Hoa Hồng Giúp Dưỡng ẩm cho da, Se khít lỗ chân lông - Guty Hone",53.700,,152,Hà Nội,30,https://www.lazada.vn/products/sua-rua-mat-kisson-145ml-lam-sach-sau-tu-be-mat-den-chan-long-gel-rua-mat-tinh-chat-hoa-hong-giup-duong-am-cho-da-se-khit-lo-chan-long-guty-hone-i1540601046.html
"Kem dưỡng Dear Klairs Midnight Blue Calming Cream 30ml làm dịu, phục hồi da hiệu quả cao",125.000,,66,Hà Nội,22,https://www.lazada.vn/products/kem-duong-dear-klairs-midnight-blue-calming-cream-30ml-lam-diu-phuc-hoi-da-hieu-qua-cao-i2234372634.html
Kem xóa nếp nhăn nhanh Hexapeptide 50ml Chống nhăn nhanh chóng làm mịn nếp nhăn nâng cơ và săn chắc da mặt làm mịn và dưỡng ẩm se lỗ chân lông thông dụng cho mọi loại da nam và nữ,142.000,,174,Hải Phòng,47,https://www.lazada.vn/products/kem-xoa-nep-nhan-nhanh-hexapeptide-50ml-chong-nhan-nhanh-chong-lam-min-nep-nhan-nang-co-va-san-chac-da-mat-lam-min-va-duong-am-se-lo-chan-long-thong-dung-cho-moi-loai-da-nam-va-nu-i1724957845.html
Kem BB Gloss Serum Dưỡng Trắng Meso Axit Hyaluronic Tinh Chất Dưỡng Da Thẩm Mỹ Viện Trang Điểm Hàn Quốc Làm Sáng Da Chống Lão Hóa,164.753,,,Nước ngoài,19,https://www.lazada.vn/products/kem-bb-gloss-serum-duong-trang-meso-axit-hyaluronic-tinh-chat-duong-da-tham-my-vien-trang-diem-han-quoc-lam-sang-da-chong-lao-hoa-i2017053548.html
Sữa Rửa Mặt Sạch Sâu Dưỡng Ẩm Cerave 236ml,139.000,,98,Hà Nội,42,https://www.lazada.vn/products/sua-rua-mat-sach-sau-duong-am-cerave-236ml-i2135869718.html
[HÀNG MỚI VỀ] Gel Tẩy Tế Bào Chết Trà Xanh Sữa Rửa Mặt Tẩy Tế Bào Chết Sữa Rửa Mặt Làm Sạch Sâu Làm Trắng Làm Sáng Dưỡng Ẩm Loại Bỏ Mụn Đầu Đen Kiểm Soát Thu Nhỏ Lỗ Chân Lông Chăm Sóc Da 60G- Laura's Cosmetics,30.000,,112,Hồ Chí Minh,46,https://www.lazada.vn/products/hang-moi-ve-gel-tay-te-bao-chet-tra-xanh-sua-rua-mat-tay-te-bao-chet-sua-rua-mat-lam-sach-sau-lam-trang-lam-sang-duong-am-loai-bo-mun-dau-den-kiem-soat-thu-nho-lo-chan-long-cham-soc-da-60g-lauras-cosmetics-i1348486788.html
Mặt Nạ Cổ Peptide Sữa Dê Miếng Dán Mờ Nếp Nhăn Cổ Dưỡng Ẩm Cổ Nuôi Dưỡng Da Giảm Khô,25.700,,7,Nước ngoài,85,https://www.lazada.vn/products/mat-na-co-peptide-sua-de-mieng-dan-mo-nep-nhan-co-duong-am-co-nuoi-duong-da-giam-kho-i1869153972.html
ERUM DƯỠNG MI Dưỡng dài mi dày mi cong mi Bioaqua DMB29,27.900,,35,Hà Nội,9,https://www.lazada.vn/products/erum-duong-mi-duong-dai-mi-day-mi-cong-mi-bioaqua-dmb29-i1556487475.html
"Kem Face Lạnh Dưỡng Trắng Da Ban Đem N Collagen - Kem Face Lạnh NCollagen Dưỡng Da, Cấp Ẩm, Mờ Nám",335.000,,,Đăk Lăk,1,https://www.lazada.vn/products/kem-face-lanh-duong-trang-da-ban-dem-n-collagen-kem-face-lanh-ncollagen-duong-da-cap-am-mo-nam-i2180395301.html
Dearbeauty Kem Loại Bỏ Sẹo Mụn Gel Sửa Chữa Sẹo Mặt Cơ Thể Làm Sáng Vết Rạn Da Vết Rạn Da Sửa Vết Sẹo Trên Mặt Kem Dưỡng Ẩm Tăng Tốc Tế Bào 20G,29.900,,50,Nước ngoài,7,https://www.lazada.vn/products/dearbeauty-kem-loai-bo-seo-mun-gel-sua-chua-seo-mat-co-the-lam-sang-vet-ran-da-vet-ran-da-sua-vet-seo-tren-mat-kem-duong-am-tang-toc-te-bao-20g-i2048907408.html
Cammuo Mặt Nạ Nén Dưỡng Ẩm Mặt Nạ Cotton Dùng Một Lần Mặt Nạ Giấy Bọc Chăm Sóc Da Mặt,10.000,,687,Nước ngoài,120,https://www.lazada.vn/products/cammuo-mat-na-nen-duong-am-mat-na-cotton-dung-mot-lan-mat-na-giay-boc-cham-soc-da-mat-i2092131009.html
Kem Retinol KLady Care Dưỡng Trắng Cấp ẩm .Làm Mờ Thâm Nám,99.000,,11,Hà Nội,7,https://www.lazada.vn/products/kem-retinol-klady-care-duong-trang-cap-am-lam-mo-tham-nam-i2314616604.html
Sữa Rửa Mặt Rau Má Skin1004 Giảm Mụn Và Làm Dịu Da,89.000,,6,Hà Nội,6,https://www.lazada.vn/products/sua-rua-mat-rau-ma-skin1004-giam-mun-va-lam-diu-da-i2268878296.html
"v Mặt nạ dưỡng ẩm thon gọn sửa chữa toàn diện, cấp nước, nuôi dưỡng da, nâng cơ, căng collagen, thu nhỏ lỗ chân lông, làm sáng đều màu da, ngừa mụn",125.000,,,Hà Nội,1,https://www.lazada.vn/products/v-mat-na-duong-am-thon-gon-sua-chua-toan-dien-cap-nuoc-nuoi-duong-da-nang-co-cang-collagen-thu-nho-lo-chan-long-lam-sang-deu-mau-da-ngua-mun-i2163892514.html
Serum Vaseline dưỡng trắng nách khử mùi cam kết sản phẩm đúng mô tả chất lượng đảm bảo an toàn cho người sử dụng,75.000,,328,Hà Nội,47,https://www.lazada.vn/products/serum-vaseline-duong-trang-nach-khu-mui-cam-ket-san-pham-dung-mo-ta-chat-luong-dam-bao-an-toan-cho-nguoi-su-dung-i925842455.html
"Hydra B5 Prettyskin Phục Hồi, Dưỡng Trắng Da",89.000,,5,Hà Nội,3,https://www.lazada.vn/products/hydra-b5-prettyskin-phuc-hoi-duong-trang-da-i2326708329.html
Kem dưỡng trắng da ban ngày Yanko,450.000,,8,Hà Nội,7,https://www.lazada.vn/products/kem-duong-trang-da-ban-ngay-yanko-i1248474277.html
Viên nang dưỡng da hiệu quả Elizabeth Arden ( tách lẻ) sản phẩm tốt chất lượng cao cam kết như hình độ bền cao xin vui lòng inbox shop để được tư vấn thêm về thông tin,18.000,,9,Nam Định,2,https://www.lazada.vn/products/vien-nang-duong-da-hieu-qua-elizabeth-arden-tach-le-san-pham-tot-chat-luong-cao-cam-ket-nhu-hinh-do-ben-cao-xin-vui-long-inbox-shop-de-duoc-tu-van-them-ve-thong-tin-i1003108361.html
Kem dưỡng ẩm ILLIYOON Ceramide Ato Cream làm dịu và phục hồi da tốt phù hợp mọi loại da,295.000,,19,Hồ Chí Minh,3,https://www.lazada.vn/products/kem-duong-am-illiyoon-ceramide-ato-cream-lam-diu-va-phuc-hoi-da-tot-phu-hop-moi-loai-da-i2208062922.html
"[CHÍNH HÃNG]Kem Dưỡng Trắng Da Bật Tông Ngọc Trai Cấp Ẩm LIFTHENG Whitening Cream Giúp Da Mặt Mịn Màng, Se Khít Lỗ Chân Lông, Giữ Ẩm Và Tái Tạo Da Mặt Tươi Trẻ Đầy Sức Sống",155.000,,11,Hà Nội,9,https://www.lazada.vn/products/chinh-hangkem-duong-trang-da-bat-tong-ngoc-trai-cap-am-liftheng-whitening-cream-giup-da-mat-min-mang-se-khit-lo-chan-long-giu-am-va-tai-tao-da-mat-tuoi-tre-day-suc-song-i2209140348.html
Mặt Nạ Nghệ Hưng Yên Cocoon 30ml face mask giúp mờ thâm dưỡng ẩm da,94.000,,511,Hà Nội,102,https://www.lazada.vn/products/mat-na-nghe-hung-yen-cocoon-30ml-face-mask-giup-mo-tham-duong-am-da-i2262698357.html
"[ CHÍNH HÃNG] Sữa Rửa Mặt Làm Trắng Da, Ngừa Mụn Senana 60g Trẻ Hóa, Kiểm Soát Dầu, Dưỡng Ẩm Lấy Sạch Bụi Bẩn",140.000,,20,Hà Nội,12,https://www.lazada.vn/products/chinh-hang-sua-rua-mat-lam-trang-da-ngua-mun-senana-60g-tre-hoa-kiem-soat-dau-duong-am-lay-sach-bui-ban-i2215742183.html
Sữa rửa mặt ngừa mụn dưỡng sáng Hazeline nghệ hoa cúc 100g (hongthamshopcom)- SRM43,50.000,,13,Hà Nội,2,https://www.lazada.vn/products/sua-rua-mat-ngua-mun-duong-sang-hazeline-nghe-hoa-cuc-100g-hongthamshopcom-srm43-i1532106511.html
Mặt Nạ Sủi Bọt Heyxi Chính Hãng Sạch Mụn Đầu Đen Se Khít Lỗ Chân Lông Mặt Nạ Dưỡng Ẩm Trắng Da Phục Hồi Da Hư Tổn,43.000,,50,Hồ Chí Minh,11,https://www.lazada.vn/products/mat-na-sui-bot-heyxi-chinh-hang-sach-mun-dau-den-se-khit-lo-chan-long-mat-na-duong-am-trang-da-phuc-hoi-da-hu-ton-i2092914281.html
Kem Dưỡng Da 30G Trắng Hồng Rạng Rỡ Ban Đêm/ ngày,86.000,,5,Hồ Chí Minh,1,https://www.lazada.vn/products/kem-duong-da-30g-trang-hong-rang-ro-ban-dem-ngay-i2095638697.html
Kem dưỡng ẩm Silky Elite Peptides / Mediword,545.000,,22,Hà Nội,3,https://www.lazada.vn/products/kem-duong-am-silky-elite-peptides-mediword-i2087748212.html
"[CHÍNH HÃNG] Serum Dưỡng Trắng Vitamin C SADOER , Thu Nhỏ Lỗ Chân Lông, Trẻ Hóa Da, Giúp Da Đều Màu, Giảm Vùng Thâm Mắt, Chống Nám, Tàn Nhang, Không Đều Màu Thích Hợp Cho Mọi Loại Da",105.000,,8,Hà Nội,7,https://www.lazada.vn/products/chinh-hang-serum-duong-trang-vitamin-c-sadoer-thu-nho-lo-chan-long-tre-hoa-da-giup-da-deu-mau-giam-vung-tham-mat-chong-nam-tan-nhang-khong-deu-mau-thich-hop-cho-moi-loai-da-i2107322928.html
[TẶNG THÊM 4 MIẾNG] Combo 15 Mặt nạ dưỡng da Hàn Quốc Dermal,143.000,,22,Hồ Chí Minh,5,https://www.lazada.vn/products/tang-them-4-mieng-combo-15-mat-na-duong-da-han-quoc-dermal-i1738357939.html
"SERUM trẻ hoá da thương hiệu UCUC , hoàn toàn từ Thiên Nhiên ,ngăn ngừa lão hóa, xóa mờ nếp nhăn, đánh bay nám sạm, cho da săn chắc, dưỡng da,",199.999,,26,Hà Nội,3,https://www.lazada.vn/products/serum-tre-hoa-da-thuong-hieu-ucuc-hoan-toan-tu-thien-nhien-ngan-ngua-lao-hoa-xoa-mo-nep-nhan-danh-bay-nam-sam-cho-da-san-chac-duong-da-i2206263751.html
TINH CHẤT DƯỠNG DA CĂNG BÓNG NHÂN SÂM MQ SKIN - MỸ PHẨM MQSKIN,239.999,,,Hồ Chí Minh,1,https://www.lazada.vn/products/tinh-chat-duong-da-cang-bong-nhan-sam-mq-skin-my-pham-mqskin-i1222305663.html
"Dưỡng Vaseline Nga cao cấp, dùng dưỡng môi hoặc dùng lau chùi vệ sinh môi mày trong phun xăm thẩm mỹ, dưỡng vaselin mềm mịn",30.000,,43,Hồ Chí Minh,2,https://www.lazada.vn/products/duong-vaseline-nga-cao-cap-dung-duong-moi-hoac-dung-lau-chui-ve-sinh-moi-may-trong-phun-xam-tham-my-duong-vaselin-mem-min-i2100781628.html
kem Retinol K Lady care 30ml Hàn Quốc dưỡng căng bóng trẻ hóa da,285.000,,,Hồ Chí Minh,1,https://www.lazada.vn/products/kem-retinol-k-lady-care-30ml-han-quoc-duong-cang-bong-tre-hoa-da-i2129062219.html
Mặt Nạ HA images mask giấy dưỡng trắng da và cấp ẩm thải độc,3.000,,8,Hà Nội,1,https://www.lazada.vn/products/mat-na-ha-images-mask-giay-duong-trang-da-va-cap-am-thai-doc-i1962629310.html
Kem dưỡng Clobetamil,13.000,,512,Đăk Lăk,27,https://www.lazada.vn/products/kem-duong-clobetamil-i486420916.html
[HCM][Lẻ 1] Đầu kim Nano tiêm dưỡng chất 30g 32g,6.000,,391,Hồ Chí Minh,20,https://www.lazada.vn/products/hcmle-1-dau-kim-nano-tiem-duong-chat-30g-32g-i906016072.html
The Ordinary Azelaic Acid Suspension 10% Kem Dưỡng Da Ngăn Ngừa Mụn Giảm Thâm,88.000,,14,Hồ Chí Minh,3,https://www.lazada.vn/products/the-ordinary-azelaic-acid-suspension-10-kem-duong-da-ngan-ngua-mun-giam-tham-i2299012080.html
Combo 10 Mặt Nạ Giấy HA Images Bioaqua Dưỡng Ẩm Trắng Da,28.000,,5,Hồ Chí Minh,1,https://www.lazada.vn/products/combo-10-mat-na-giay-ha-images-bioaqua-duong-am-trang-da-i2077551623.html
"KEM BODY TRỨNG VÀNG 2 LÒNG TRẮNG & ĐỎ Giúp Dưỡng Dạ, Trắng Bật Tone Ngay Lần Đầu Sử Dụng, Không Chất Tẩy và Bào Mòn Da, Kem Thấm Nhanh Vào Da",150.000,,5,Hồ Chí Minh,4,https://www.lazada.vn/products/kem-body-trung-vang-2-long-trang-do-giup-duong-da-trang-bat-tone-ngay-lan-dau-su-dung-khong-chat-tay-va-bao-mon-da-kem-tham-nhanh-vao-da-i2095130591.html
Erya Kem Retinol Chống Lão Hóa Chính Hãng Từ Hàn Quốc Và Kem Retinol Làm Trắng Cho Mặt Kem Chống Lão Hóa Retinol Kem Mặt Kem Thu Nhỏ Lỗ Chân Lông Collagen Kem Dưỡng Ẩm Da Chăm Sóc Se Khít Lỗ Chân Lông Giảm Nếp Nhăn Sửa Chữa Hư Tổn,21.000,,28,Nước ngoài,3,https://www.lazada.vn/products/erya-kem-retinol-chong-lao-hoa-chinh-hang-tu-han-quoc-va-kem-retinol-lam-trang-cho-mat-kem-chong-lao-hoa-retinol-kem-mat-kem-thu-nho-lo-chan-long-collagen-kem-duong-am-da-cham-soc-se-khit-lo-chan-long-giam-nep-nhan-sua-chua-hu-ton-i2161583111.html
"Kem Dưỡng Da SK-II R N A Power 80g Trắng Da , Chống Lão Hóa, Cấp Ẩm",57.000,,7,Hồ Chí Minh,2,https://www.lazada.vn/products/kem-duong-da-sk-ii-r-n-a-power-80g-trang-da-chong-lao-hoa-cap-am-i2164336622.html
"Mặt nạ diếp cá tái sinh MIEE Organic chính hãng 120g Dưỡng ẩm trắng da, mờ thâm, thải độc cho da",457.000,,71,Hà Nội,22,https://www.lazada.vn/products/mat-na-diep-ca-tai-sinh-miee-organic-chinh-hang-120g-duong-am-trang-da-mo-tham-thai-doc-cho-da-i2254751126.html
[HCM]Mặt Nạ Giấy Dưỡng Da Mụn Cấp Ẩm Thải Độc Hyaluronic Images,32.000,,471,Hồ Chí Minh,141,https://www.lazada.vn/products/hcmmat-na-giay-duong-da-mun-cap-am-thai-doc-hyaluronic-images-i1336506212.html
Kem dưỡng ẩm trắng da nhau thai cừu careline 100g chính hãng,99.000,,40,Hà Nội,22,https://www.lazada.vn/products/kem-duong-am-trang-da-nhau-thai-cuu-careline-100g-chinh-hang-i1661210587.html
"[SIÊU SALE] Máy Đẩy Tinh Chất ion - Di Mặt - Massage, Dưỡng Da Mặt Ion Led Hồng Ngoại, Dưỡng Da Mặt Trắng Sáng, Se Khít Lỗ Chân Lông, Giảm Bã Nhờn. Có Bảo Hành 1 Đổi 1",149.000,,67,Hồ Chí Minh,11,https://www.lazada.vn/products/sieu-sale-may-day-tinh-chat-ion-di-mat-massage-duong-da-mat-ion-led-hong-ngoai-duong-da-mat-trang-sang-se-khit-lo-chan-long-giam-ba-nhon-co-bao-hanh-1-doi-1-i1583596980.html
Sản phẩm đắp mặt nạ thảo dược ĐT Dưỡng Da Giữ Ẩm trj mụn (100gr),89.000,,14,Hồ Chí Minh,1,https://www.lazada.vn/products/san-pham-dap-mat-na-thao-duoc-dt-duong-da-giu-am-trj-mun-100gr-i358712073.html
"Kem Demejine Hàn Quốc, Kem dưỡng da dưỡng trắng loại bỏ mụn nám tàn nhang chống lão hóa da hiệu quả",75.000,,62,Hồ Chí Minh,10,https://www.lazada.vn/products/kem-demejine-han-quoc-kem-duong-da-duong-trang-loai-bo-mun-nam-tan-nhang-chong-lao-hoa-da-hieu-qua-i1225748650.html
[HCM]Cốt Nghệ Hạt Gấc Hạ Thổ Cho Mặt và Body (500ml) - Dưỡng Da Sáng Trắng Mịn Da cot gung ha tho cot gung nghe hat gac ha tho nghe gac ha tho,110.000,,48,Hồ Chí Minh,11,https://www.lazada.vn/products/hcmcot-nghe-hat-gac-ha-tho-cho-mat-va-body-500ml-duong-da-sang-trang-min-da-cot-gung-ha-tho-cot-gung-nghe-hat-gac-ha-tho-nghe-gac-ha-tho-i969296578.html
NQSW Thắt chặt Kem làm săn chắc cổ Làm mịn Dưỡng ẩm Kem chống nhăn Chăm sóc da Làm sáng đường mảnh Kem chống lão hóa Phụ nữ,37.000,,,Nước ngoài,1,https://www.lazada.vn/products/nqsw-that-chat-kem-lam-san-chac-co-lam-min-duong-am-kem-chong-nhan-cham-soc-da-lam-sang-duong-manh-kem-chong-lao-hoa-phu-nu-i2514447687.html
"Mặt nạ Niacinamide dưỡng trắng, cấp ẩm phục hồi da",15.000,,51,Hà Nội,7,https://www.lazada.vn/products/mat-na-niacinamide-duong-trang-cap-am-phuc-hoi-da-i2216219944.html
Gel Nha Đam Dưỡng Ẩm & Làm Mềm Da Nuôi dưỡng làn da không nhờn- Gel Lô Hội 92% Aloe Vera Gel 40g,170.000,,,Hà Nội,1,https://www.lazada.vn/products/gel-nha-dam-duong-am-lam-mem-da-nuoi-duong-lan-da-khong-nhon-gel-lo-hoi-92-aloe-vera-gel-40g-i2102925146.html
Kem dưỡng trắng da dưỡng ẩm dưỡng trắng ngày đêm V7 Image,23.000,,,Hà Nội,1,https://www.lazada.vn/products/kem-duong-trang-da-duong-am-duong-trang-ngay-dem-v7-image-i2408132670.html
Kem dưỡng ẩm Clinique,150.000,,201,Hà Nội,25,https://www.lazada.vn/products/kem-duong-am-clinique-i1556807799.html
Sữa rửa mặt bơ oil control facial foam thái lan dưỡng ẩm và làm trắng da,60.000,,13,Hà Nội,1,https://www.lazada.vn/products/sua-rua-mat-bo-oil-control-facial-foam-thai-lan-duong-am-va-lam-trang-da-i1958977172.html
MẶT NẠ DƯỠNG DA NABIONE,10.000,,13,Hồ Chí Minh,2,https://www.lazada.vn/products/mat-na-duong-da-nabione-i2218618876.html
Sữa rửa mặt simple Sữa Rửa Mặt Axit Amin Làm Sạch Nhẹ Nhàng Kiểm Soát Dầu Giảm Mụn Đầu Đen sữa rửa mặt trắng da chính hãng 120Ml Thiết kế sáng tạo mở xoay tròn Hyaluronic Acid rửa mặt bọt dưỡng ẩm Duo,136.000,,,Hà Nội,1,https://www.lazada.vn/products/sua-rua-mat-simple-sua-rua-mat-axit-amin-lam-sach-nhe-nhang-kiem-soat-dau-giam-mun-dau-den-sua-rua-mat-trang-da-chinh-hang-120ml-thiet-ke-sang-tao-mo-xoay-tron-hyaluronic-acid-rua-mat-bot-duong-am-duo-i2164978855.html
Sữa Rửa Mặt Dưỡng Ẩm IMAGES Kiềm Dầu Làm Sạch Sâu - BILIDA,29.000,,,Hà Nội,1,https://www.lazada.vn/products/sua-rua-mat-duong-am-images-kiem-dau-lam-sach-sau-bilida-i2229655421.html
[HCM]Tinh Chất Dưỡng Da Serum Timeless Q10 (30ml),439.000,,34,Hồ Chí Minh,4,https://www.lazada.vn/products/hcmtinh-chat-duong-da-serum-timeless-q10-30ml-i515016099.html
Tinh Chất Dưỡng Trắng Phục Hồi Da Preetyskin B5 50ml chăm sóc da mặt,79.000,,7,Hà Nội,2,https://www.lazada.vn/products/tinh-chat-duong-trang-phuc-hoi-da-preetyskin-b5-50ml-cham-soc-da-mat-i2260724606.html
"Mặt nạ dưỡng da nha đam Aloe Mask – Dưỡng ẩm, mềm mịn da, ngăn ngừa lão hóa – Hộp 10 túi x 25g",130.000,,,Hà Nội,1,https://www.lazada.vn/products/mat-na-duong-da-nha-dam-aloe-mask-duong-am-mem-min-da-ngan-ngua-lao-hoa-hop-10-tui-x-25g-i2122750011.html
Dưỡng vitamin ad túi /100 gói nhỏ,75.000,,9,Hà Nội,3,https://www.lazada.vn/products/duong-vitamin-ad-tui-100-goi-nho-i2468615258.html
Kem Retinol KLady Care Dưỡng Trắng Cấp ẩm .Làm Mờ Thâm Nám,99.000,,8,Hà Nội,5,https://www.lazada.vn/products/kem-retinol-klady-care-duong-trang-cap-am-lam-mo-tham-nam-i2314836869.html
Combo 3 mặt nạ dưỡng da cấp ẩm thải độc. Mix các loại hàng Nội Địa Trung,50.000,,,Đồng Nai,1,https://www.lazada.vn/products/combo-3-mat-na-duong-da-cap-am-thai-doc-mix-cac-loai-hang-noi-dia-trung-i1754264912.html
"Serum viên dưỡng da căng bóng VEZE Siêu Phẩm dưỡng da cung cấp collagen thu nhỏ lỗ chân lông, căng mướt, sáng hồng",24.000,,26,Hà Nội,1,https://www.lazada.vn/products/serum-vien-duong-da-cang-bong-veze-sieu-pham-duong-da-cung-cap-collagen-thu-nho-lo-chan-long-cang-muot-sang-hong-i2110805434.html
Sữa Rửa Mặt Dưỡng Ẩm IMAGES Kiềm Dầu Làm Sạch Sâu - Laura's Cosmetics,30.000,,6,Hồ Chí Minh,2,https://www.lazada.vn/products/sua-rua-mat-duong-am-images-kiem-dau-lam-sach-sau-lauras-cosmetics-i1348954836.html
Mặt Nạ Nhau Thai Cuống Rốn Tế Bào Gốc Dưỡng Da Căng Bóng Giá Rẻ Tách Lẻ 1 Miếng,3.000,,27,Hà Nội,2,https://www.lazada.vn/products/mat-na-nhau-thai-cuong-ron-te-bao-goc-duong-da-cang-bong-gia-re-tach-le-1-mieng-i2144623141.html
"Kem Dưỡng Ẩm Phục Hồi Da, Tăng Độ Đàn Hồi Và Xóa Nhăn, Ngừa Mụn Hiệu Quả Từ Tinh Chất Nhau Thai Cừu, Kem Dưỡng Phù Hợp Với Mọi Loại Da",125.000,,8,Hà Nội,5,https://www.lazada.vn/products/kem-duong-am-phuc-hoi-da-tang-do-dan-hoi-va-xoa-nhan-ngua-mun-hieu-qua-tu-tinh-chat-nhau-thai-cuu-kem-duong-phu-hop-voi-moi-loai-da-i2264087537.html
"Bột Tảo Xoắn Spirulina Nhật Bản, Mặt Nạ Tảo Xoắn Volayon Nguyên Chất, Dưỡng Da Trắng Mịn, Hữu Cơ",49.000,,13,Hồ Chí Minh,3,https://www.lazada.vn/products/bot-tao-xoan-spirulina-nhat-ban-mat-na-tao-xoan-volayon-nguyen-chat-duong-da-trang-min-huu-co-i2158945722.html
"[hót hót - 5 hộp]Mặt nạ,Mặt nạ cà rốt, cải thiện mờ thâm, giảm mụn,cung cấp độ ẩm cho da thương hiệu YANFU.",111.111,,17,Hà Nội,8,https://www.lazada.vn/products/hot-hot-5-hopmat-namat-na-ca-rot-cai-thien-mo-tham-giam-muncung-cap-do-am-cho-da-thuong-hieu-yanfu-i2252572605.html
Mặt nạ Weilaiya chính hãng hộp 10 miếng cỏ vạn năm hồng vạn cánh dưỡng trắng da phục hồi chống lão hóa,299.000,,7,Hồ Chí Minh,7,https://www.lazada.vn/products/mat-na-weilaiya-chinh-hang-hop-10-mieng-co-van-nam-hong-van-canh-duong-trang-da-phuc-hoi-chong-lao-hoa-i2115489555.html
Sữa rửa mặt HERSKIN dưỡng trắng da - ngừa mụn - sạch nhờn chiết xuất từ nhụy hoa nghệ tây Saffron 60ml,95.000,,50,Hồ Chí Minh,5,https://www.lazada.vn/products/sua-rua-mat-herskin-duong-trang-da-ngua-mun-sach-nhon-chiet-xuat-tu-nhuy-hoa-nghe-tay-saffron-60ml-i1116118931.html
"KARASHE kem dưỡng da Linh Chi, Ngọc Trai, Collagen SPF50 ++ - KRS",330.000,,94,Hồ Chí Minh,19,https://www.lazada.vn/products/karashe-kem-duong-da-linh-chi-ngoc-trai-collagen-spf50-krs-i486434194.html
Serum Truyền Trắng Mờ Thâm The Elf Nano White Dose Thái Lan - Serum Dưỡng Trắng The Elf Thailand,169.000,,46,Hồ Chí Minh,7,https://www.lazada.vn/products/serum-truyen-trang-mo-tham-the-elf-nano-white-dose-thai-lan-serum-duong-trang-the-elf-thailand-i2227565584.html
"Kem dưỡng DAKAMI 2 Chống Lão Hóa Hàn Quốc, Dưỡng Trắng Da Mặt, Giảm Nám, Tàn Nhang, Nếp Nhăn, Chân Chim Vùng Mắt",99.000,,26,Thanh Hóa,11,https://www.lazada.vn/products/kem-duong-dakami-2-chong-lao-hoa-han-quoc-duong-trang-da-mat-giam-nam-tan-nhang-nep-nhan-chan-chim-vung-mat-i1244517642.html
"[ Mua 7 tặng 1] hộp 100gr Mặt nạ cao tinh nghệ ngân bình, mặt nạ thải độc da, dưỡng da mặt , thu nhỏ lỗ chân lông, mặt nạ ngủ khử thâm mụn, mờ nám",38.900,,34,Thừa Thiên Huế,13,https://www.lazada.vn/products/mua-7-tang-1-hop-100gr-mat-na-cao-tinh-nghe-ngan-binh-mat-na-thai-doc-da-duong-da-mat-thu-nho-lo-chan-long-mat-na-ngu-khu-tham-mun-mo-nam-i1031892121.html
💖CHÍNH HÃNG💖 Serum Vitamin E Dưỡng Trắng Da Làm Sáng Căng Bóng Da Ngăn Lão Hóa Chống Thâm Mắt Và Bọng Mắt,45.000,,25,Hồ Chí Minh,3,https://www.lazada.vn/products/chinh-hang-serum-vitamin-e-duong-trang-da-lam-sang-cang-bong-da-ngan-lao-hoa-chong-tham-mat-va-bong-mat-i1640967464.html
[HCM]Combo 10 gói Kem dưỡng làm mát da Sum Water-full Radiant Hydrating Glow Cream,28.000,,11,Hồ Chí Minh,1,https://www.lazada.vn/products/hcmcombo-10-goi-kem-duong-lam-mat-da-sum-water-full-radiant-hydrating-glow-cream-i791544414.html
"Kem Chống Nhăn Hexapeptide, Làm Trắng Dưỡng Ẩm Chống Lão Hóa Nâng Da Săn Chắc 70G",22.100,,500,Nước ngoài,84,https://www.lazada.vn/products/kem-chong-nhan-hexapeptide-lam-trang-duong-am-chong-lao-hoa-nang-da-san-chac-70g-i1467816462.html
[Trắng Body Siêu Tốc] Kem dưỡng collagen sữa non làm trắng da dưỡng ẩm và cung cấp vitamin cho toàn thân Dr.AEC 100gr,47.000,,125,Hồ Chí Minh,18,https://www.lazada.vn/products/trang-body-sieu-toc-kem-duong-collagen-sua-non-lam-trang-da-duong-am-va-cung-cap-vitamin-cho-toan-than-draec-100gr-i1292334716.html
(Tem chính hãng) Sữa Rửa Mặt Dưỡng Ẩm Ohui Miracle Moisture Cleansing Foam Mini Size 80ML- Full Size 200ML- Set 200ML💝100ML . Date 2026,129.000,,36,Hồ Chí Minh,14,https://www.lazada.vn/products/tem-chinh-hang-sua-rua-mat-duong-am-ohui-miracle-moisture-cleansing-foam-mini-size-80ml-full-size-200ml-set-200ml100ml-date-2026-i2099691233.html
"Mặt nạ làm trắng và xóa tàn nhang，Dưỡng ẩm chuyên sâu，làm trắng và mờ các vết nám, cấp nước và dưỡng ẩm, làm sáng da, mang lại làn da nữ tính và mềm mại.",28.000,,36,Hải Phòng,7,https://www.lazada.vn/products/mat-na-lam-trang-va-xoa-tan-nhangduong-am-chuyen-saulam-trang-va-mo-cac-vet-nam-cap-nuoc-va-duong-am-lam-sang-da-mang-lai-lan-da-nu-tinh-va-mem-mai-i2168261985.html
"Kem dưỡng mắt xóa quầng thâm tinh chất collagen kèm đầu lăn massage, Kem dưỡng mắt chống nhăn đầu matxa giúp làm mờ nếp nhăn chống lão hóa da mắt , Kem dưỡng da mắt đánh tan bọng mắt CASSIA",250.000,,137,Hồ Chí Minh,30,https://www.lazada.vn/products/kem-duong-mat-xoa-quang-tham-tinh-chat-collagen-kem-dau-lan-massage-kem-duong-mat-chong-nhan-dau-matxa-giup-lam-mo-nep-nhan-chong-lao-hoa-da-mat-kem-duong-da-mat-danh-tan-bong-mat-cassia-i1963684110.html
Tinh Chất Chống Nhăn Nicotinamide Serum Dưỡng Ẩm Và Làm Săn Chắc Da Dưỡng chất giúp giảm thâm nám nếp nhăn và làm đều màu da nhanh chóng làm mờ vết nhăn trên mặt chống lão hóa dưỡng ẩm loại bỏ vết nhăn làm đẹp,45.000,,24,Nước ngoài,14,https://www.lazada.vn/products/tinh-chat-chong-nhan-nicotinamide-serum-duong-am-va-lam-san-chac-da-duong-chat-giup-giam-tham-nam-nep-nhan-va-lam-deu-mau-da-nhanh-chong-lam-mo-vet-nhan-tren-mat-chong-lao-hoa-duong-am-loai-bo-vet-nhan-lam-dep-i2510692256.html
"Mặt nạ giấy trái cây SADOER/ YEXIANYAN/ FUZIMEI/BIOAQUA/HANHUO/SEOMOU dưỡng ẩm phục hồi, tái tạo giúp da căng bóng, cấp ẩm, trắng da và dịu da",2.422,,4.5K,Hồ Chí Minh,94,https://www.lazada.vn/products/mat-na-giay-trai-cay-sadoer-yexianyan-fuzimeibioaquahanhuoseomou-duong-am-phuc-hoi-tai-tao-giup-da-cang-bong-cap-am-trang-da-va-diu-da-i1925694316.html
"Kem Dưỡng Retinol K Lady Care Hàn Quốc 30ml giảm mụn, mờ thâm nám , làm trắng, chống lão hoá",129.000,,134,Hà Nội,43,https://www.lazada.vn/products/kem-duong-retinol-k-lady-care-han-quoc-30ml-giam-mun-mo-tham-nam-lam-trang-chong-lao-hoa-i2266430416.html
"Kem Huyết Rồng O’MELIN 1 tầng dưỡng trắng, dưỡng ẩm, nám, sạm da cho da mịn màng",36.000,,169,Hà Nội,37,https://www.lazada.vn/products/kem-huyet-rong-omelin-1-tang-duong-trang-duong-am-nam-sam-da-cho-da-min-mang-i2105706353.html
Kem làm trắng kem tàn nhang 20g Kem dưỡng ẩm loại bỏ các đốm đen và loại bỏ melanin và kem chăm sóc da tự nhiên,120.000,,26,Hồ Chí Minh,16,https://www.lazada.vn/products/kem-lam-trang-kem-tan-nhang-20g-kem-duong-am-loai-bo-cac-dom-den-va-loai-bo-melanin-va-kem-cham-soc-da-tu-nhien-i2229677083.html
