ProductName,ProductPrice,ProductDiscount,ProductSold,ProductAddress,ProductReviewCount,Productlink
"HỘP 5 Miếng Mặt Nạ Tinh Thể Nâng Cơ Dưỡng Trắng Mịn Da, Cấp Ẩm, Mờ Thâm, Chống Lão Hóa da",19.999,,271,Hà Nội,24,https://www.lazada.vn/products/hop-5-mieng-mat-na-tinh-the-nang-co-duong-trang-min-da-cap-am-mo-tham-chong-lao-hoa-da-i2157445538.html
KEM DƯỠNG TRẮNG DA ỐC SÊN,89.000,,121,Hà Nội,97,https://www.lazada.vn/products/kem-duong-trang-da-oc-sen-i985986654.html
"Sữa rửa mặt axit amin Làm sạch nhẹ nhàng Sữa rửa mặt cho nam 100g Nuôi dưỡng và dưỡng ẩm Dưỡng da giữ ẩm và cân bằng độ ẩm và dầu cho da không có dầu khoáng Nhiều bọt, nhẹ nhàng và không chặt chẽ",105.000,,30,Hải Phòng,2,https://www.lazada.vn/products/sua-rua-mat-axit-amin-lam-sach-nhe-nhang-sua-rua-mat-cho-nam-100g-nuoi-duong-va-duong-am-duong-da-giu-am-va-can-bang-do-am-va-dau-cho-da-khong-co-dau-khoang-nhieu-bot-nhe-nhang-va-khong-chat-che-i2135714271.html
"Sữa Rửa Mặt Sạch Sâu, Dưỡng Ẩm Cerave 236ml",139.000,,30,Hà Nội,29,https://www.lazada.vn/products/sua-rua-mat-sach-sau-duong-am-cerave-236ml-i2136054110.html
Tế Bào Gốc Cá Hồi DNA Siêu Dưỡng Da,59.000,,6,Hà Nội,3,https://www.lazada.vn/products/te-bao-goc-ca-hoi-dna-sieu-duong-da-i2150145857.html
"Mặt nạ lột vàng dưỡng da, chống lão hóa Huasurv - dưỡng da trắng sáng, giảm thâm, mờ nám, chống lão hóa da, giảm nếp nhăn, săn chắc da",199.000,,9,Đà Nẵng,3,https://www.lazada.vn/products/mat-na-lot-vang-duong-da-chong-lao-hoa-huasurv-duong-da-trang-sang-giam-tham-mo-nam-chong-lao-hoa-da-giam-nep-nhan-san-chac-da-i2131952678.html
Sữa Rửa Mặt Làm Trắng Da Sữa Rửa Mặt Axit Amin Làm Sạch Nhẹ Nhàng Kiểm Soát Dầu Giảm Mụn Đầu Đen sữa rửa mặt trắng da chính hãng 120Ml Thiết kế sáng tạo mở xoay tròn Hyaluronic Acid rửa mặt bọt dưỡng ẩm Duo,135.000,,,Hải Phòng,3,https://www.lazada.vn/products/sua-rua-mat-lam-trang-da-sua-rua-mat-axit-amin-lam-sach-nhe-nhang-kiem-soat-dau-giam-mun-dau-den-sua-rua-mat-trang-da-chinh-hang-120ml-thiet-ke-sang-tao-mo-xoay-tron-hyaluronic-acid-rua-mat-bot-duong-am-duo-i2209422721.html
Mặt nạ dưỡng da trái cây cao cấp hàng nội địa - mix ngẫu nhiên,35.000,,,Hồ Chí Minh,1,https://www.lazada.vn/products/mat-na-duong-da-trai-cay-cao-cap-hang-noi-dia-mix-ngau-nhien-i2234351286.html
[HCM]kem cải thiện mụn và dưỡng trắng da Huỳnh Đỗ,150.000,,,Hồ Chí Minh,2,https://www.lazada.vn/products/hcmkem-cai-thien-mun-va-duong-trang-da-huynh-do-i1232724914.html
"Kem dưỡng da MEIDUZI Nhật Bản ngày và đêm (20g) dưỡng ẩm căng bóng da, giảm thâm mụn, tàn nhang, trẻ hoá da",129.000,,114,Hà Nội,36,https://www.lazada.vn/products/kem-duong-da-meiduzi-nhat-ban-ngay-va-dem-20g-duong-am-cang-bong-da-giam-tham-mun-tan-nhang-tre-hoa-da-i2170043897.html
[Derma Factory] Kem dưỡng ẩm Aquaporin Hydrating Cream 70g,150.000,,,Hồ Chí Minh,1,https://www.lazada.vn/products/derma-factory-kem-duong-am-aquaporin-hydrating-cream-70g-i2402645528.html
"Tinh chất Hydra B5 Prettyskin Phục Hồi, Dưỡng Trắng Da",89.000,,,Hà Nội,2,https://www.lazada.vn/products/tinh-chat-hydra-b5-prettyskin-phuc-hoi-duong-trang-da-i2413073190.html
KEM DƯỠNG TRẮNG 3X PHƯƠNG ANH,250.000,,49,Bình Dương,11,https://www.lazada.vn/products/kem-duong-trang-3x-phuong-anh-i2025253196.html
"[CHÍNH HÃNG] Serum chăm sóc da CĂNG BÓNG, CHỐNG LÃO HÓA, GIẢM NẾP NHĂN EELHOE , Dưỡng Ẩm Và Giữ Ẩm, Làm Da Trắng Sáng, Da Săn Chắc Mịn Màng Hơn Trông Thấy 30ml",95.000,,8,Hà Nội,8,https://www.lazada.vn/products/chinh-hang-serum-cham-soc-da-cang-bong-chong-lao-hoa-giam-nep-nhan-eelhoe-duong-am-va-giu-am-lam-da-trang-sang-da-san-chac-min-mang-hon-trong-thay-30ml-i2208016944.html
"Dưỡng chất kiểm soát nhờn Lana, kiềm dầu 6-8h da mịn màng không tì vết Shine spa",70.000,,20,Đồng Nai,4,https://www.lazada.vn/products/duong-chat-kiem-soat-nhon-lana-kiem-dau-6-8h-da-min-mang-khong-ti-vet-shine-spa-i2066258318.html
Kem Retinol KLady Care Dưỡng Trắng Cấp ẩm .Làm Mờ Thâm Nám,99.000,,,Hà Nội,3,https://www.lazada.vn/products/kem-retinol-klady-care-duong-trang-cap-am-lam-mo-tham-nam-i2315069314.html
Sữa rửa mặt VIBRANT GLAMOUR chứa Arbutin Amino Acid Vitamin C làm sạch sâu dưỡng ẩm kiềm dầu làm sáng da 100g,187.000,,15,Hồ Chí Minh,8,https://www.lazada.vn/products/sua-rua-mat-vibrant-glamour-chua-arbutin-amino-acid-vitamin-c-lam-sach-sau-duong-am-kiem-dau-lam-sang-da-100g-i2292179124.html
"Mặt Nạ FOCALLURE - Dưỡng Ẩm, Sáng Da, Kiểm Soát Dầu 3.8g",6.500,,,Hồ Chí Minh,1,https://www.lazada.vn/products/mat-na-focallure-duong-am-sang-da-kiem-soat-dau-38g-i2114275215.html
Kem dưỡng da Bioderma Cicabio Creme,195.000,,131,Hồ Chí Minh,41,https://www.lazada.vn/products/kem-duong-da-bioderma-cicabio-creme-i1312241803.html
Kem Dưỡng Trắng Chống Nhăn Whitening & WrinKle Cream R&B Hàn Quốc,300.000,,8,Hà Nội,1,https://www.lazada.vn/products/kem-duong-trang-chong-nhan-whitening-wrinkle-cream-rb-han-quoc-i1668968771.html
"Kem Dưỡng Da Laroche Posayy B5 làm dịu kích ứng, phục hồi làn da",79.000,,9,Hà Nội,7,https://www.lazada.vn/products/kem-duong-da-laroche-posayy-b5-lam-diu-kich-ung-phuc-hoi-lan-da-i2117224596.html
Kem Dưỡng Trắng Da Ban Ngày Face Lạnh Cool Cream Dr Lacir (Mẫu Mới Hộp 50 Gram) - Kem chống nắng vật lý CoolCream,234.000,,212,Hồ Chí Minh,14,https://www.lazada.vn/products/kem-duong-trang-da-ban-ngay-face-lanh-cool-cream-dr-lacir-mau-moi-hop-50-gram-kem-chong-nang-vat-ly-coolcream-i2175220165.html
"Serum UCUC trẻ hóa làn da, tinh chất dưỡng da, chống lão hóa, giúp mờ nếp nhăn, đồi mồi, vết chân chim, đánh bay nám sạm",99.000,,21,Hồ Chí Minh,10,https://www.lazada.vn/products/serum-ucuc-tre-hoa-lan-da-tinh-chat-duong-da-chong-lao-hoa-giup-mo-nep-nhan-doi-moi-vet-chan-chim-danh-bay-nam-sam-i2248000843.html
"Tinh chất dưỡng trắng, mờ thâm nám tàn nhang Mediskinbyc pure C+ vitamin C ampoule 30ml",380.000,,,Hà Nội,3,https://www.lazada.vn/products/tinh-chat-duong-trang-mo-tham-nam-tan-nhang-mediskinbyc-pure-c-vitamin-c-ampoule-30ml-i1483098172.html
KEM FACE TRỨNG VÀNG DƯỠNG DA MẶT CAO CẤP QUEENIE SKIN tặng kèm 1 mặt nạ nhau thai dưỡng trắng da 10k,244.000,,,Hồ Chí Minh,2,https://www.lazada.vn/products/kem-face-trung-vang-duong-da-mat-cao-cap-queenie-skin-tang-kem-1-mat-na-nhau-thai-duong-trang-da-10k-i2098086023.html
[Hàng Cao Cấp] Kem dưỡng ẩm làm trắng da FOR MEN Cho Nam Chống Nếp Nhăn Chăm Sóc Che Khuyết Điểm chống lão hóa mờ thâm nám phục hồi làn da,65.000,,246,Hà Nội,61,https://www.lazada.vn/products/hang-cao-cap-kem-duong-am-lam-trang-da-for-men-cho-nam-chong-nep-nhan-cham-soc-che-khuyet-diem-chong-lao-hoa-mo-tham-nam-phuc-hoi-lan-da-i1743989758.html
[Kone]Hộp 2 hủ kem ngày và đêm Kone Thái lan - Dưỡng da làm mờ vết thâm ngăn ngừa mụn tái phát,59.999,,,Hồ Chí Minh,1,https://www.lazada.vn/products/konehop-2-hu-kem-ngay-va-dem-kone-thai-lan-duong-da-lam-mo-vet-tham-ngan-ngua-mun-tai-phat-i1509061307.html
"Hộp mặt nạ dưỡng da cấp ẩm làm mờ nếp nhăn, phục hồi hư tổn Absolute Repair - VIETNAM’S SUPPELEMENTS",19.000,,32,Hà Nội,6,https://www.lazada.vn/products/hop-mat-na-duong-da-cap-am-lam-mo-nep-nhan-phuc-hoi-hu-ton-absolute-repair-vietnams-suppelements-i2076432243.html
Sữa rửa mặt cerave dành cho da dầu da mụn và nhạy cảm 236ml,115.000,,1.6K,Hà Nội,315,https://www.lazada.vn/products/sua-rua-mat-cerave-danh-cho-da-dau-da-mun-va-nhay-cam-236ml-i2307436389.html
[BÁN CHẠY]Sữa Rửa Mặt Dưỡng Ẩm IMAGES Kiềm Dầu Làm Sạch Sâu-LUTAMALY,29.000,,63,Hà Nội,24,https://www.lazada.vn/products/ban-chaysua-rua-mat-duong-am-images-kiem-dau-lam-sach-sau-lutamaly-i2065501840.html
[Hoàn tiền 20%] Kem SUR.MEDIC Dưỡng Trắng Sáng Da 40ml,135.000,,853,Hà Nội,146,https://www.lazada.vn/products/hoan-tien-20-kem-surmedic-duong-trang-sang-da-40ml-i1989951041.html
"Sữa Rửa Mặt Sạch Sâu, Dưỡng Ẩm Cerave 236ml",139.000,,29,Hà Nội,27,https://www.lazada.vn/products/sua-rua-mat-sach-sau-duong-am-cerave-236ml-i2135830841.html
"[ CHÍNH HÃNG] Tinh chất chăm sóc da dạng Kem Huyết Rồng Dưỡng Trắng Da EXO TOO Tinh Chất Nhau Thai Cừu Và Bột Ngọc Trai, Kem Dưỡng Da Giúp Làm Mờ Nám Sáng Da Căng Mịn",205.000,,30,Hà Nội,22,https://www.lazada.vn/products/chinh-hang-tinh-chat-cham-soc-da-dang-kem-huyet-rong-duong-trang-da-exo-too-tinh-chat-nhau-thai-cuu-va-bot-ngoc-trai-kem-duong-da-giup-lam-mo-nam-sang-da-cang-min-i2205669237.html
"Kem dưỡng da MEIDUZI Nhật Bản ngày và đêm (20g) ngừa lão hoá, giảm mụn nám, căng mịn da hiệu quả",129.000,,227,Hà Nội,54,https://www.lazada.vn/products/kem-duong-da-meiduzi-nhat-ban-ngay-va-dem-20g-ngua-lao-hoa-giam-mun-nam-cang-min-da-hieu-qua-i2169667836.html
Kem V7 Dưỡng Trắng Và Tái Tạo Da ⚡️𝐌𝐢𝐞̂̃𝐧 𝐏𝐡𝐢́ 𝐒𝐡𝐢𝐩⚡️,165.000,,473,Hà Nội,134,https://www.lazada.vn/products/kem-v7-duong-trang-va-tai-tao-da-i1849712246.html
"[CHÍNH HÃNG] Da CĂNG BÓNG mịn mang, kem dưỡng chiết xuất cỏ phục sinh EBUG cấp ẩm chuyên sâu, trắng da , nguồn gốc tự nhiên, da tươi trẻ căng tràn sức sống 80ML",199.000,,39,Hà Nội,35,https://www.lazada.vn/products/chinh-hang-da-cang-bong-min-mang-kem-duong-chiet-xuat-co-phuc-sinh-ebug-cap-am-chuyen-sau-trang-da-nguon-goc-tu-nhien-da-tuoi-tre-cang-tran-suc-song-80ml-i2212803180.html
Serum Medi Peel Luxury 24K Gold Ampoule Hàn Quốc 100ml Tinh chất vàng cấp ẩm dưỡng da sáng mịn ngăn ngừa lão hóa,125.000,,26,Hà Nội,22,https://www.lazada.vn/products/serum-medi-peel-luxury-24k-gold-ampoule-han-quoc-100ml-tinh-chat-vang-cap-am-duong-da-sang-min-ngan-ngua-lao-hoa-i2198109651.html
ủ trắng kén tằm chính hãng đan thy dưỡng da căng bóng,156.000,,,Hà Nội,1,https://www.lazada.vn/products/u-trang-ken-tam-chinh-hang-dan-thy-duong-da-cang-bong-i1503594601.html
Kem dưỡng da mặt Vaseline 250g Giữ ẩm và bổ sung nước Dưỡng ẩm mặt và chống nứt khô Không nhờn Toàn thân đều có thể sử dụng Sữa dưỡng ẩm Nicotinamide Sữa dưỡng da Vitamin E 100g,26.000,,29,Nước ngoài,7,https://www.lazada.vn/products/kem-duong-da-mat-vaseline-250g-giu-am-va-bo-sung-nuoc-duong-am-mat-va-chong-nut-kho-khong-nhon-toan-than-deu-co-the-su-dung-sua-duong-am-nicotinamide-sua-duong-da-vitamin-e-100g-i2491572198.html
Kem dưỡng da trái cây bume mụn tàn nhang sử dụng ban đêm chính hãng thái lan 20g,115.000,,12,An Giang,2,https://www.lazada.vn/products/kem-duong-da-trai-cay-bume-mun-tan-nhang-su-dung-ban-dem-chinh-hang-thai-lan-20g-i1941758713.html
"Kem Dưỡng Ẩm Hatomugi Moisturizing & Conditioning The Milky Nhật Bản 300g, Kem Dưỡng Trắng Da Hatomugi Moisturizing & Conditioning The Milky Nhật Bản 300g, Gel Dưỡng Ẩm Trắng Da Naturie Chiết Xuất Hạt Ý Dĩ 180g Skin Conditioning Saikou",105.000,,143,Hà Nội,18,https://www.lazada.vn/products/kem-duong-am-hatomugi-moisturizing-conditioning-the-milky-nhat-ban-300g-kem-duong-trang-da-hatomugi-moisturizing-conditioning-the-milky-nhat-ban-300g-gel-duong-am-trang-da-naturie-chiet-xuat-hat-y-di-180g-skin-conditioning-saikou-i2055367155.html
kem huyết rồng dưỡng trắng cấp ẩm da,45.000,,,Hà Nội,2,https://www.lazada.vn/products/kem-huyet-rong-duong-trang-cap-am-da-i2031588569.html
[HCM]Kem trái cây bume thái lan nám tàn nhang dưỡng da dùng ban ngày chính hãng thái lan 20 gam,115.000,,21,An Giang,3,https://www.lazada.vn/products/hcmkem-trai-cay-bume-thai-lan-nam-tan-nhang-duong-da-dung-ban-ngay-chinh-hang-thai-lan-20-gam-i1074438380.html
Kem Retinol KLady Care Dưỡng Trắng Cấp ẩm .Làm Mờ Thâm Nám,99.000,,5,Hà Nội,5,https://www.lazada.vn/products/kem-retinol-klady-care-duong-trang-cap-am-lam-mo-tham-nam-i2314206846.html
[TẶNG THÊM 3 MIẾNG] Combo 10 gói mặt nạ dưỡng da Hàn Quốc Dermal - giao ngẫu nhiên,95.000,,165,Hồ Chí Minh,36,https://www.lazada.vn/products/tang-them-3-mieng-combo-10-goi-mat-na-duong-da-han-quoc-dermal-giao-ngau-nhien-i1700623871.html
Kem Retinol KLady Care Dưỡng Trắng Cấp ẩm .Làm Mờ Thâm Nám,99.000,,6,Hà Nội,4,https://www.lazada.vn/products/kem-retinol-klady-care-duong-trang-cap-am-lam-mo-tham-nam-i2315108009.html
"Serum Vitamin C Facentry, Serum Sáng Da, Mờ Thâm Nám, Dưỡng Ẩm, Ngăn Ngừa Mụn Cải Thiện Làn Da Xỉn Màu, Đẹp Da Chống Lão Hoá Và Nếp Nhăn 30ml",110.000,,,Hà Nội,3,https://www.lazada.vn/products/serum-vitamin-c-facentry-serum-sang-da-mo-tham-nam-duong-am-ngan-ngua-mun-cai-thien-lan-da-xin-mau-dep-da-chong-lao-hoa-va-nep-nhan-30ml-i2094152884.html
Kem Retinol KLady Care Dưỡng Trắng Cấp ẩm .Làm Mờ Thâm Nám,99.000,,9,Hà Nội,6,https://www.lazada.vn/products/kem-retinol-klady-care-duong-trang-cap-am-lam-mo-tham-nam-i2314404953.html
"Axit salicylic kiểm soát dầu, sữa rửa mặt axit amin kiểm soát dầu Sữa rửa mặt dưỡng ẩm làm trắng da 500ml làm sạch sâuTẩy tế bào chết, phục hồi đa chức Sữa rửa mặt salicylic Axit 0.5% 150ml tái tạo da hiệu quả",160.000,,9,Hải Phòng,6,https://www.lazada.vn/products/axit-salicylic-kiem-soat-dau-sua-rua-mat-axit-amin-kiem-soat-dau-sua-rua-mat-duong-am-lam-trang-da-500ml-lam-sach-sautay-te-bao-chet-phuc-hoi-da-chuc-sua-rua-mat-salicylic-axit-05-150ml-tai-tao-da-hieu-qua-i2231165597.html
Kem Retinol KLady Care Dưỡng Trắng Cấp ẩm .Làm Mờ Thâm Nám,99.000,,5,Hà Nội,3,https://www.lazada.vn/products/kem-retinol-klady-care-duong-trang-cap-am-lam-mo-tham-nam-i2314912668.html
"Tinh chất Hydra B5 Prettyskin Phục Hồi, Dưỡng Trắng Da",89.000,,,Hà Nội,1,https://www.lazada.vn/products/tinh-chat-hydra-b5-prettyskin-phuc-hoi-duong-trang-da-i2409596512.html
"[SIÊU PHẨM] COMBO 20 Gói Mặt Nạ Ngủ Thạch Collagen Purime - Giúp Nâng Cơ Mặt, Bổ Sung Collagen, Săn Chắc Da, Chống Lão Hóa, Dưỡng Ẩm Sâu, Nâng Cơ Mặt Hiệu Quả Nhanh Chóng",100.000,,10,Hà Nội,7,https://www.lazada.vn/products/sieu-pham-combo-20-goi-mat-na-ngu-thach-collagen-purime-giup-nang-co-mat-bo-sung-collagen-san-chac-da-chong-lao-hoa-duong-am-sau-nang-co-mat-hieu-qua-nhanh-chong-i2107409585.html
Kem Dưỡng Da Mặt VIBRANT GLAMOUR Chứa Retinol Tự Nhiên Chống Lão Hóa Giảm Nếp Nhăn Làm Mờ Vết Đốm Đen Làm Săn,165.000,,26,Hồ Chí Minh,6,https://www.lazada.vn/products/kem-duong-da-mat-vibrant-glamour-chua-retinol-tu-nhien-chong-lao-hoa-giam-nep-nhan-lam-mo-vet-dom-den-lam-san-i2280308608.html
"Kem chăm sóc và dưỡng da mặt dạng gel, 061flp",175.000,,22,Đăk Nông,3,https://www.lazada.vn/products/kem-cham-soc-va-duong-da-mat-dang-gel-061flp-i2163466052.html
Serum jelly fish & plankton booster tảo biển dưỡng da hàng chính hãng hàn quốc 50ml,75.000,,36,An Giang,1,https://www.lazada.vn/products/serum-jelly-fish-plankton-booster-tao-bien-duong-da-hang-chinh-hang-han-quoc-50ml-i1686949810.html
"the ordinary-serum niacinamide 10% + Zinc 1% 30ml,dưỡng ẩm da mặt, giảm mụn và ngừa mụn.",115.000,,24,Hà Nội,6,https://www.lazada.vn/products/the-ordinary-serum-niacinamide-10-zinc-1-30mlduong-am-da-mat-giam-mun-va-ngua-mun-i2262633363.html
Mask Dưỡng Da Nhau Thai Cừu Nhật Bản Full Hộp 50 Miếng - Mask Giấy Rwine Dưỡng Ẩm & Trắng Da,145.000,,,Hồ Chí Minh,1,https://www.lazada.vn/products/mask-duong-da-nhau-thai-cuu-nhat-ban-full-hop-50-mieng-mask-giay-rwine-duong-am-trang-da-i2234107952.html
"[ CHÍNH HÃNG ] Tinh chất chăm sóc da DƯỠNG DA CĂNG BÓNG VEZE Siêu Phẩm dưỡng da cung cấp collagen thu nhỏ lỗ chân lông, căng mướt, sáng hồng (Hộp 30 Viên)",95.000,,9,Hà Nội,4,https://www.lazada.vn/products/chinh-hang-tinh-chat-cham-soc-da-duong-da-cang-bong-veze-sieu-pham-duong-da-cung-cap-collagen-thu-nho-lo-chan-long-cang-muot-sang-hong-hop-30-vien-i2203744019.html
Kem Bơ Mụn Thịt YAQINUO Dưỡng Ẩm Nội Địa Trung,24.000,,193,Hồ Chí Minh,26,https://www.lazada.vn/products/kem-bo-mun-thit-yaqinuo-duong-am-noi-dia-trung-i1287272735.html
Dưỡng Ẩm Nâng Tông Da Cho Da Nâu Toàn Thân Hemp Lotion Malibu Golden Glow Gradual Tanning Lotion 530Ml,450.000,,26,Hồ Chí Minh,8,https://www.lazada.vn/products/duong-am-nang-tong-da-cho-da-nau-toan-than-hemp-lotion-malibu-golden-glow-gradual-tanning-lotion-530ml-i2100820106.html
(Chính hãng) Sữa Rửa Mặt Nữ Lro'Cre - Sửa Rửa Mặt Dưỡng Ẩm làm sáng da loại bỏ bụi bẩn tế bào sừng già,115.000,,27,Hồ Chí Minh,1,https://www.lazada.vn/products/chinh-hang-sua-rua-mat-nu-lrocre-sua-rua-mat-duong-am-lam-sang-da-loai-bo-bui-ban-te-bao-sung-gia-i1997427426.html
"[ HOÀN TIỀN 15% ] Bột Thảo mộc Sunnary rửa sạch mặt sáng da sạch mụn nám, sản phẩm thiên nhiên làm sạch đẹp hiệu quả",49.000,,137,Hồ Chí Minh,24,https://www.lazada.vn/products/hoan-tien-15-bot-thao-moc-sunnary-rua-sach-mat-sang-da-sach-mun-nam-san-pham-thien-nhien-lam-sach-dep-hieu-qua-i324838858.html
"Mặt Nạ Diếp Cá Tái Sinh MeeA Organic - Mask nhiếp cá đắp mặt Gel Diếp Cá Tái Sinh Meea Organic 120g Đắp Mặt , Mờ Thâm Nám , Dưỡng Trắng , Ngăn Ngừa Mụn ,Kháng Khuẩn, Dụng Cụ Chăm Sóc Da Mặt Hiệu Quả",49.000,,,Hồ Chí Minh,1,https://www.lazada.vn/products/mat-na-diep-ca-tai-sinh-meea-organic-mask-nhiep-ca-dap-mat-gel-diep-ca-tai-sinh-meea-organic-120g-dap-mat-mo-tham-nam-duong-trang-ngan-ngua-mun-khang-khuan-dung-cu-cham-soc-da-mat-hieu-qua-i2239669156.html
Sữa Rửa Mặt CERAVE 236ml Dành Cho Da Khô Da Dầu Da Nhạy Cảm Dịu Nhẹ Cần Bằng Độ PH - cuahangthienduc,71.500,,371,Hồ Chí Minh,55,https://www.lazada.vn/products/sua-rua-mat-cerave-236ml-danh-cho-da-kho-da-dau-da-nhay-cam-diu-nhe-can-bang-do-ph-cuahangthienduc-i2257568463.html
Kem dưỡng làm dịu và phục hồi da Klairs Midnight Blue Calming Cream,79.000,,9,Hà Nội,7,https://www.lazada.vn/products/kem-duong-lam-diu-va-phuc-hoi-da-klairs-midnight-blue-calming-cream-i2117345130.html
"Bộ 2 hộp Kem Nghệ Q Care White Thái Lan giảm mụn, giảm thâm, dưỡng da mềm mịn 5g x2 [HÀNG CHUẨN 100%]",95.000,,133,Hồ Chí Minh,30,https://www.lazada.vn/products/bo-2-hop-kem-nghe-q-care-white-thai-lan-giam-mun-giam-tham-duong-da-mem-min-5g-x2-hang-chuan-100-i479082379.html
"Tinh Chất Serum dưỡng trắng, chống lão hóa Chiết Xuất Lựu Đỏ",20.990,,664,Hồ Chí Minh,117,https://www.lazada.vn/products/tinh-chat-serum-duong-trang-chong-lao-hoa-chiet-xuat-luu-do-i290036924.html
"Tinh chất Prettyskin Hydra Max Serum B5 (lọ 50ml) Korea giúp cấp ẩm, làm dịu, phục hồi dưỡng trắng da",129.000,,183,Hà Nội,56,https://www.lazada.vn/products/tinh-chat-prettyskin-hydra-max-serum-b5-lo-50ml-korea-giup-cap-am-lam-diu-phuc-hoi-duong-trang-da-i2267266636.html
"Tinh Chất Prettyskin Hydra Max Serum B5 (50ml) phục hồi cấp ẩm sâu dưỡng trắng da, giảm thâm kháng viêm ngừa lão hoá",129.000,,208,Hà Nội,54,https://www.lazada.vn/products/tinh-chat-prettyskin-hydra-max-serum-b5-50ml-phuc-hoi-cap-am-sau-duong-trang-da-giam-tham-khang-viem-ngua-lao-hoa-i2267357031.html
"Mặt Nạ Nâng Cơ SEOMOU Dưỡng Trắng Mịn Da, Cấp Ẩm, Mờ Thâm, Chống Lão Hóa",19.000,,135,Hà Nội,20,https://www.lazada.vn/products/mat-na-nang-co-seomou-duong-trang-min-da-cap-am-mo-tham-chong-lao-hoa-i2052801739.html
Kem dưỡng la roche posay baume b5 40ml làm dịu kích ứng phục hồi da,105.000,,222,Hà Nội,73,https://www.lazada.vn/products/kem-duong-la-roche-posay-baume-b5-40ml-lam-diu-kich-ung-phuc-hoi-da-i1928792749.html
[Mua 2 tặng SERUM] Kem Hút Nám - Thải Chì Femmiu 30 Thải độc làm sạch sâu tẩy da chết và dưỡng trắng mờ thâm [ Cam Kết chính Hãng ],49.000,,58,Hồ Chí Minh,13,https://www.lazada.vn/products/mua-2-tang-serum-kem-hut-nam-thai-chi-femmiu-30-thai-doc-lam-sach-sau-tay-da-chet-va-duong-trang-mo-tham-cam-ket-chinh-hang-i1292461155.html
[Hoàn tiền 20%] Kem Dưỡng Trắng Da Body Bạch Ngọc Liên - Kem Dưỡng Trắng da,270.000,,931,Hà Nội,278,https://www.lazada.vn/products/hoan-tien-20-kem-duong-trang-da-body-bach-ngoc-lien-kem-duong-trang-da-i1941468772.html
Kem dưỡng da sau tái tạo số 3 dưỡng trắng hồng sáng mịn da thành phần collagen và nhân sâm cung cấp độ ẩm phục hồi dưỡng trắng da chống nắng căng bóng sáng mịn phục hồi da lão hoá làm săn chắc nâng tông,162.000,,58,Hồ Chí Minh,11,https://www.lazada.vn/products/kem-duong-da-sau-tai-tao-so-3-duong-trang-hong-sang-min-da-thanh-phan-collagen-va-nhan-sam-cung-cap-do-am-phuc-hoi-duong-trang-da-chong-nang-cang-bong-sang-min-phuc-hoi-da-lao-hoa-lam-san-chac-nang-tong-i1228909720.html
Mặt Nạ Thạch Trong Suốt BIOAQUA - Mặt Nạ Thạch Collagen Cấp Ẩm Dưỡng Da,5.500,,129,Hà Nội,2,https://www.lazada.vn/products/mat-na-thach-trong-suot-bioaqua-mat-na-thach-collagen-cap-am-duong-da-i1983606681.html
"Sữa Rửa Mặt Sạch Sâu, Dưỡng Ẩm Cerave 236ml",139.000,,24,Hà Nội,23,https://www.lazada.vn/products/sua-rua-mat-sach-sau-duong-am-cerave-236ml-i2135871055.html
Kem Huyết Rồng Dưỡng Trắng Da O'Melin 50gr,75.000,,18,Hà Nội,7,https://www.lazada.vn/products/kem-huyet-rong-duong-trang-da-omelin-50gr-i2048360334.html
[20 cái tặng máy đẩy tinh chất] Combo 20 mặt nạ collagen Empathy cấp ẩm dưỡng da chuyên sâu lấy lại·làn da đàn hồi căng bóng mịn màng,95.000,,200,Hà Nội,44,https://www.lazada.vn/products/20-cai-tang-may-day-tinh-chat-combo-20-mat-na-collagen-empathy-cap-am-duong-da-chuyen-sau-lay-lailan-da-dan-hoi-cang-bong-min-mang-i2098770750.html
Tinh dầu dưỡng mi chiết xuất tự nhiên giúp mi dài tự nhiên - INTL,39.000,,2.4K,Nước ngoài,326,https://www.lazada.vn/products/tinh-dau-duong-mi-chiet-xuat-tu-nhien-giup-mi-dai-tu-nhien-intl-i388124667.html
Serum Dưỡng Ẩm Dành Cho Da Mặt Giúp Sáng Da Chống Lão Hóa Giảm Tàn Nhang Hiệu Quả Với Chiết Xuất Tự Nhiên,75.000,,30,Hà Nội,15,https://www.lazada.vn/products/serum-duong-am-danh-cho-da-mat-giup-sang-da-chong-lao-hoa-giam-tan-nhang-hieu-qua-voi-chiet-xuat-tu-nhien-i2150891672.html
Sữa Rửa Mặt Chuyên Sâu Sáng Da Sạch Mụn BIOAQUA Chiết Xuất Cám Gạo Lấy Sạch Bụi Bẩn Nuôi Dưỡng Tế Bào Giúp Da Trắng Sáng Dưỡng Ẩm Cho Da Mềm Mượt,24.500,,76,Hà Nội,32,https://www.lazada.vn/products/sua-rua-mat-chuyen-sau-sang-da-sach-mun-bioaqua-chiet-xuat-cam-gao-lay-sach-bui-ban-nuoi-duong-te-bao-giup-da-trang-sang-duong-am-cho-da-mem-muot-i2089809913.html
"Son dưỡng mỡ hươu Astrid Hàng chuẩn Auth - Son dưỡng ẩm và tẩy da chết môi mỡ hươu Astrid, ẩm mềm hồng môi",42.000,,5,Hồ Chí Minh,1,https://www.lazada.vn/products/son-duong-mo-huou-astrid-hang-chuan-auth-son-duong-am-va-tay-da-chet-moi-mo-huou-astrid-am-mem-hong-moi-i2098763120.html
Eelhoe Mặt Nạ Làm Săn Chắc Collagen Chăm Sóc Da Kiểm Soát Lỗ Chân Lông Dưỡng Ẩm Chăm Sóc Mụn Chính Hãng Làm Trắng Da Không Cần Rửa Mặt Nạ Dùng Khi Ngủ Collagen Làm Săn Chắc Không Cần Rửa Làm Săn Chắc Chống Lão Hóa Mặt Nạ Cho Phụ Nữ Thoải Mái Và Làm Sạch S,85.260,,5,Hồ Chí Minh,100,https://www.lazada.vn/products/eelhoe-mat-na-lam-san-chac-collagen-cham-soc-da-kiem-soat-lo-chan-long-duong-am-cham-soc-mun-chinh-hang-lam-trang-da-khong-can-rua-mat-na-dung-khi-ngu-collagen-lam-san-chac-khong-can-rua-lam-san-chac-chong-lao-hoa-mat-na-cho-phu-nu-thoai-mai-va-lam-sach-s-i2237610758.html
"Bột Đắp Mặt Nạ Thuốc Bắc Dưỡng Da, Giảm Mụn và Trẻ Hóa 50GR~100GR - Handmade",20.000,,,Hà Nội,1,https://www.lazada.vn/products/bot-dap-mat-na-thuoc-bac-duong-da-giam-mun-va-tre-hoa-50gr100gr-handmade-i1793581910.html
Mặt nạ dưỡng da HA Hyaluronic Acid nội địa trung - mặt nạ giấy dưỡng da cấp ẩm thải độc,3.000,,444,Hà Nội,42,https://www.lazada.vn/products/mat-na-duong-da-ha-hyaluronic-acid-noi-dia-trung-mat-na-giay-duong-da-cap-am-thai-doc-i2004218488.html
Nước Hoa Hồng Klairs Dưỡng Ẩm Chống Viêm,139.000,,7,Hà Nội,4,https://www.lazada.vn/products/nuoc-hoa-hong-klairs-duong-am-chong-viem-i2176655971.html
Kem Dưỡng Da Ban Đêm Ngọc Trai Eaoron Black Shining Cream 50ml của Úc,176.000,,12,Hà Nội,5,https://www.lazada.vn/products/kem-duong-da-ban-dem-ngoc-trai-eaoron-black-shining-cream-50ml-cua-uc-i1768956171.html
"MẶT NẠ B5 REPAIR PHỤC HỒI, DƯỠNG ẨM LÀM DỊU DA",8.500,,28,Hà Nội,2,https://www.lazada.vn/products/mat-na-b5-repair-phuc-hoi-duong-am-lam-diu-da-i2209873847.html
"sữa rửa mặt dưỡng ẩm làm trắng da, sạch da ngừa lão hóa IMAGES 60g",60.000,,5,Hà Nội,5,https://www.lazada.vn/products/sua-rua-mat-duong-am-lam-trang-da-sach-da-ngua-lao-hoa-images-60g-i2150231366.html
"Tinh chất Hydra B5 Prettyskin Phục Hồi, Dưỡng Trắng Da",89.000,,,Hà Nội,1,https://www.lazada.vn/products/tinh-chat-hydra-b5-prettyskin-phuc-hoi-duong-trang-da-i2409486377.html
