ProductName,ProductPrice,ProductDiscount,ProductSold,ProductAddress,ProductReviewCount,Productlink
"Mặt nạ miếng Images dưỡng da ,sáng da tái tạo phục hồi da mặt nạ chống lão hóa da dưỡng ẩm, ngừa nếp nhăn COXITO",3.000,40%,,Hà Nội,1,https://www.lazada.vn/products/mat-na-mieng-images-duong-da-sang-da-tai-tao-phuc-hoi-da-mat-na-chong-lao-hoa-da-duong-am-ngua-nep-nhan-coxito-i2036057346.html
Mặt nạ dưỡng da nội địa trung,5.100,25%,8,Hà Nội,1,https://www.lazada.vn/products/mat-na-duong-da-noi-dia-trung-i2230044415.html
Mặt nạ ngủ dưỡng da trắng da dưỡng ẩm ha sữa đào NaCleverr,5.800,42%,11,Hà Nội,4,https://www.lazada.vn/products/mat-na-ngu-duong-da-trang-da-duong-am-ha-sua-dao-nacleverr-i2134508807.html
Mặt Nạ HA images mask giấy dưỡng trắng da và cấp ẩm thải độc,3.000,50%,8,Hà Nội,1,https://www.lazada.vn/products/mat-na-ha-images-mask-giay-duong-trang-da-va-cap-am-thai-doc-i1962629310.html
"Hộp mặt nạ dưỡng da cấp ẩm làm mờ nếp nhăn, phục hồi hư tổn Absolute Repair - VIETNAM’S SUPPELEMENTS",19.000,32%,32,Hà Nội,6,https://www.lazada.vn/products/hop-mat-na-duong-da-cap-am-lam-mo-nep-nhan-phuc-hoi-hu-ton-absolute-repair-vietnams-suppelements-i2076432243.html
Mặt Nạ Giấy Các Loại ( Nạ Ha)(Nạ Nhau Thai)(Nạ Thủy Tinh) Dưỡng Da Trăng Da Cấp Ẩm Se Khít Lỗ Chân Lông Mờ Thâm,3.500,50%,50,Hà Nội,8,https://www.lazada.vn/products/mat-na-giay-cac-loai-na-hana-nhau-thaina-thuy-tinh-duong-da-trang-da-cap-am-se-khit-lo-chan-long-mo-tham-i2503401294.html
"Mặt nạ nhau thai cừu chính hãng, mask dưỡng da cấp ẩm cho da hanh khô nứt nẻ, dưỡng trắng da mịn màng mùa khô nẻ",5.900,50%,5,Hà Nội,1,https://www.lazada.vn/products/mat-na-nhau-thai-cuu-chinh-hang-mask-duong-da-cap-am-cho-da-hanh-kho-nut-ne-duong-trang-da-min-mang-mua-kho-ne-i2121234201.html
"Máy Phun Sương Xông Hơi Mặt NaNo Mini Cầm Tay Hỗ Trợ Dưỡng Da Cấp Nước Cân Bằng Độ Ẩm Dưỡng Da, Chống Lão Hóa Khô Da- Máy phun sương tạo ẩm khếch tán tinh dầu G.DSPS17",29.900,46%,,Phú Yên,2,https://www.lazada.vn/products/maacutey-phun-suong-xocircng-hoi-mat-nano-mini-cam-tay-ho-tro-duong-da-cap-nuoc-cacircn-bang-do-am-duong-da-chong-latildeo-hoacutea-khocirc-da-maacutey-phun-suong-tao-am-khech-taacuten-tinh-dau-gdsps17-i1459909365.html
[YÊU THÍCH]Sữa Rửa Mặt Dưỡng Ẩm IMAGES Kiềm Dầu Làm Sạch Sâu - RubyLida,29.000,43%,,Hà Nội,1,https://www.lazada.vn/products/yeu-thichsua-rua-mat-duong-am-images-kiem-dau-lam-sach-sau-rubylida-i2145200868.html
KEM DƯỠNG DA B5 LAROCHE POSAY,59.000,49%,31,Hà Nội,26,https://www.lazada.vn/products/kem-duong-da-b5-laroche-posay-i2052594896.html
Mặt Nạ Trái Cây Bioaqua Dưỡng Trắng Cấp Ẩm Căng Bóng- Cung Cấp Vitamin Cho Làn Da Khỏe Đẹp,2.786,47%,269,Hồ Chí Minh,14,https://www.lazada.vn/products/mat-na-trai-cay-bioaqua-duong-trang-cap-am-cang-bong-cung-cap-vitamin-cho-lan-da-khoe-dep-i1979912056.html
Sữa Rửa Mặt Cerave Làm Sạch Sâu dành cho Da Dầu 236ml,159.000,47%,112,Hồ Chí Minh,53,https://www.lazada.vn/products/sua-rua-mat-cerave-lam-sach-sau-danh-cho-da-dau-236ml-i2205901038.html
"Kem Retinol K Lady Care 0.5% Hàn Quốc, Kem Dưỡng Retinol Giữ Ẩm Căng Bóng Da",69.000,31%,105,Hà Nội,62,https://www.lazada.vn/products/kem-retinol-k-lady-care-05-han-quoc-kem-duong-retinol-giu-am-cang-bong-da-i471116033.html
[HCM]Glamour Axit Hyaluronic Serum Dưỡng Da Mặt Chống Lão Hóa Thu Nhỏ Lỗ Chân Lông Làm Trắng Da Tinh Chất Dưỡng Ẩm Da Mặt chăm Sóc Da Khô 15 Ml,69.000,,69,Hồ Chí Minh,17,https://www.lazada.vn/products/hcmglamour-axit-hyaluronic-serum-duong-da-mat-chong-lao-hoa-thu-nho-lo-chan-long-lam-trang-da-tinh-chat-duong-am-da-mat-cham-soc-da-kho-15-ml-i1530567983.html
Kem Dưỡng Da La Roche-Posay Làm Dịu Kích Ứng & Phục Hồi Da B5,89.000,36%,12,Hà Nội,11,https://www.lazada.vn/products/kem-duong-da-la-roche-posay-lam-diu-kich-ung-phuc-hoi-da-b5-i2176667774.html
"DELEVENTH Axit lactobionic Tinh Chất Pore Refining Tinh Chất Dưỡng Da Mặt Thu nhỏ lỗ chân lông Chống lão hóa,Serum Ngăn Ngừa Mụn DELEVENTH [FREESHIP] Thu Nhỏ Lỗ Chân Lông Cấp Ẩm Làm Sáng Da",69.000,,186,Hồ Chí Minh,64,https://www.lazada.vn/products/deleventh-axit-lactobionic-tinh-chat-pore-refining-tinh-chat-duong-da-mat-thu-nho-lo-chan-long-chong-lao-hoaserum-ngan-ngua-mun-deleventh-freeship-thu-nho-lo-chan-long-cap-am-lam-sang-da-i2016550264.html
Kem Dưỡng Phục Hồi Từ Sâu Bên Trong Da Skin1004,79.500,50%,19,Hà Nội,20,https://www.lazada.vn/products/kem-duong-phuc-hoi-tu-sau-ben-trong-da-skin1004-i2170789197.html
"Kem Phức Hợp DR-RASHEL Dưỡng Trắng Da, Ngăn Ngừa Nam, Hết Nám Tàn Nhan Cao Cấp Nuôi dưỡng Da trắng sáng đều màu giữ ẩm từ sâu bên trong Whitening Cream",153.000,50%,2.7K,Hà Nội,573,https://www.lazada.vn/products/kem-phuc-hop-dr-rashel-duong-trang-da-ngan-ngua-nam-het-nam-tan-nhan-cao-cap-nuoi-duong-da-trang-sang-deu-mau-giu-am-tu-sau-ben-trong-whitening-cream-i1330119983.html
"[Timeless] Serum phục hồi da, dưỡng ẩm Vitamin B5",339.000,25%,45,Hồ Chí Minh,11,https://www.lazada.vn/products/timeless-serum-phuc-hoi-da-duong-am-vitamin-b5-i1525548548.html
Tinh chất làm trắng sạch tàn nhang Serum Dưỡng Trắng Da Mặt Chính Hãng 100ml Loại Bỏ Tàn Nhang Hiệu Quả Chống Nhăn Dưỡng Ẩm Nuôi Dưỡng Da Giảm Melanin Làm Sáng Đều Màu Da Chống Lão Hóa,240.000,50%,9,Hải Phòng,5,https://www.lazada.vn/products/tinh-chat-lam-trang-sach-tan-nhang-serum-duong-trang-da-mat-chinh-hang-100ml-loai-bo-tan-nhang-hieu-qua-chong-nhan-duong-am-nuoi-duong-da-giam-melanin-lam-sang-deu-mau-da-chong-lao-hoa-i2171930436.html
Tinh Chất Làm Trắng Sạch Tàn Nhang Kem Hết Nám Tàn Nhang Cao Cấp Nuôi Dưỡng Da 100ml Cam Kết Hết Nám Sạm Da Trong 7 Ngày,240.000,50%,,Hải Phòng,4,https://www.lazada.vn/products/tinh-chat-lam-trang-sach-tan-nhang-kem-het-nam-tan-nhang-cao-cap-nuoi-duong-da-100ml-cam-ket-het-nam-sam-da-trong-7-ngay-i2239584883.html
Kem Mắt Collagen Làm Săn Chắc Kem Mắt Bảo Vệ Ánh Sáng Nước Dưỡng Ẩm Làm Mờ Đường Mắt Chăm Sóc Mắt,338.000,33%,,Hà Nội,2,https://www.lazada.vn/products/kem-mat-collagen-lam-san-chac-kem-mat-bao-ve-anh-sang-nuoc-duong-am-lam-mo-duong-mat-cham-soc-mat-i2103951201.html
Mặt Nạ K.i.e.h.l'.s A.vocado Nourishing Hydration M.ask Dưỡng Ẩm Ngậm Nước Mịn Da Cân Bằng Lipid Mềm Ẩm Chiết Xuất Bơ,350.000,,,Hà Nội,1,https://www.lazada.vn/products/mat-na-kiehls-avocado-nourishing-hydration-mask-duong-am-ngam-nuoc-min-da-can-bang-lipid-mem-am-chiet-xuat-bo-i2107992374.html
⚡ GÌ CŨNG RẺ ⚡kiểm soát dầu axit salicylic Sữa rửa mặt dưỡng ẩm làm trắng da 500ml làm sạch sâuTẩy tế bào chết,330.000,50%,,Hải Phòng,2,https://www.lazada.vn/products/gi-cung-re-kiem-soat-dau-axit-salicylic-sua-rua-mat-duong-am-lam-trang-da-500ml-lam-sach-sautay-te-bao-chet-i2202843763.html
Kem dưỡng làm dịu và phục hồi da Klairs Midnight Blue Calming Cream,79.000,50%,9,Hà Nội,6,https://www.lazada.vn/products/kem-duong-lam-diu-va-phuc-hoi-da-klairs-midnight-blue-calming-cream-i2115057385.html
"Serum giảm mụn dưỡng da Black Sugar Nhật Bản, tinh chất căng bóng, mờ thâm",85.000,47%,65,Hải Phòng,8,https://www.lazada.vn/products/serum-giam-mun-duong-da-black-sugar-nhat-ban-tinh-chat-cang-bong-mo-tham-i651124845.html
(Wings Shop) Sữa Rửa Mặt Cerave Foaming Facial Cleanser Dành Cho Da Dầu & Da Khô 236ml | Cerave Chính Hãng,340.000,24%,,Hà Nội,0,https://www.lazada.vn/products/wings-shop-sua-rua-mat-cerave-foaming-facial-cleanser-danh-cho-da-dau-da-kho-236ml-cerave-chinh-hang-i1465237408.html
"Set 10 Mặt Nạ Trái Cây BIOAQUA Mask Cấp Ẩm, Dưỡng Trắng Cho Da, Dưỡng Chất Làm Mềm Mịn Da",28.888,42%,14,Hà Nội,4,https://www.lazada.vn/products/set-10-mat-na-trai-cay-bioaqua-mask-cap-am-duong-trang-cho-da-duong-chat-lam-mem-min-da-i2213951373.html
"Kem dưỡng da mờ thâm nám, tàn nhang FIXDERMA SKARFIX -TX Cream 15gr [Hàng chính hãng]",270.000,7%,,Yên Bái,1,https://www.lazada.vn/products/kem-duong-da-mo-tham-nam-tan-nhang-fixderma-skarfix-tx-cream-15gr-hang-chinh-hang-i1413964802.html
Serum Retinol HT Shine Chống Lão Hóa Dưỡng Sáng Trắng Da Ngừa Mụn Làm Giảm Nếp Nhăn Hiệu,225.000,25%,102,Hà Nội,42,https://www.lazada.vn/products/serum-retinol-ht-shine-chong-lao-hoa-duong-sang-trang-da-ngua-mun-lam-giam-nep-nhan-hieu-i2067203451.html
Kem dưỡng trắng da Huxley Cream Trắng sáng ra căng bóng,79.000,50%,19,Hà Nội,5,https://www.lazada.vn/products/kem-duong-trang-da-huxley-cream-trang-sang-ra-cang-bong-i2117691851.html
"Serum VITAMIN C NCOLLAGEN dưỡng ẩm da,ngăn ngừa lão hóa da",215.000,,11,Hồ Chí Minh,2,https://www.lazada.vn/products/serum-vitamin-c-ncollagen-duong-am-dangan-ngua-lao-hoa-da-i2009975490.html
"Tinh chất dưỡng da giúp làm dịu, làm mát& phục hồi da Luxi Skin phù hợp da sau tái tạo",128.000,32%,11,Bà Rịa Vũng Tàu,2,https://www.lazada.vn/products/tinh-chat-duong-da-giup-lam-diu-lam-mat-phuc-hoi-da-luxi-skin-phu-hop-da-sau-tai-tao-i2017966160.html
"{FREESHIP TẶNG QUÀ 39K} Sữa rửa mặt dưỡng ẩm bảo vệ da,loại bỏ bui bẩn giúp da tươi sáng Cleanser Karmel",299.000,24%,169,Hà Nội,30,https://www.lazada.vn/products/freeship-tang-qua-39k-sua-rua-mat-duong-am-bao-ve-daloai-bo-bui-ban-giup-da-tuoi-sang-cleanser-karmel-i2150081022.html
Bùn khoáng biển Sữa rửa mặt Làm trắng nhanh chóng 150ml Làm Sáng Da Nâng Tone Da Dưỡng Da Tẩy Da chết làm sạch sâu da mặt cấp ẩm dưỡng trắng chăm sóc da mặt,160.000,50%,,Hải Phòng,3,https://www.lazada.vn/products/bun-khoang-bien-sua-rua-mat-lam-trang-nhanh-chong-150ml-lam-sang-da-nang-tone-da-duong-da-tay-da-chet-lam-sach-sau-da-mat-cap-am-duong-trang-cham-soc-da-mat-i2136593041.html
Kem Dưỡng Da Phục Hồi Da Rau Má Skin1004,89.000,36%,9,Hà Nội,8,https://www.lazada.vn/products/kem-duong-da-phuc-hoi-da-rau-ma-skin1004-i2176786341.html
"Serum Vita C dưỡng ẩm, chăm sóc da",425.000,6%,,Hà Nội,2,https://www.lazada.vn/products/serum-vita-c-duong-am-cham-soc-da-i1292860464.html
Sữa Rửa Mặt Axit Amin Làm Sạch Nhẹ Nhàng Kiểm Soát Dầu Giảm Mụn Đầu Đen Loại bỏ ve nhẹ nhàng Rửa và tẩy trang hợp nhất dưỡng da thực vật thu nhỏ lỗ chân lông 120g,135.000,48%,,Hải Phòng,2,https://www.lazada.vn/products/sua-rua-mat-axit-amin-lam-sach-nhe-nhang-kiem-soat-dau-giam-mun-dau-den-loai-bo-ve-nhe-nhang-rua-va-tay-trang-hop-nhat-duong-da-thuc-vat-thu-nho-lo-chan-long-120g-i2135645509.html
"Sữa rửa mặt ngăn ngừa mụn, dưỡng trắng da Lrocre 100g[Chính Hãng]",105.000,30%,6,Đăk Lăk,1,https://www.lazada.vn/products/sua-rua-mat-ngan-ngua-mun-duong-trang-da-lrocre-100gchinh-hang-i1628119360.html
Serum Vitamin C Balance Tinh chất Dưỡng Sáng Da Mờ Thâm Active Formula 30ml - 60ml,79.000,39%,6,Hà Nội,5,https://www.lazada.vn/products/serum-vitamin-c-balance-tinh-chat-duong-sang-da-mo-tham-active-formula-30ml-60ml-i2176729647.html
"[CHÍNH HÃNG] SIRUM HA PLUS MÂU MOI ,SERUM DƯỠNG DA,LỌ 20ML dùng cho mọi lứa tuổi ( )",195.000,,88,Đăk Lăk,25,https://www.lazada.vn/products/chinh-hang-sirum-ha-plus-mau-moi-serum-duong-dalo-20ml-dung-cho-moi-lua-tuoi-i1570437720.html
Kem dưỡng da Experalta Platinum Cosmetellectual Cream Facial,755.000,,,Lai Châu,1,https://www.lazada.vn/products/kem-duong-da-experalta-platinum-cosmetellectual-cream-facial-i526872787.html
Tinh Chất Làm Trắng Sạch Tàn Nhang Kem Hết Nám Tàn Nhang Cao Cấp Nuôi Dưỡng Da 100ml Cam Kết Hết Nám Sạm Da Trong 7 Ngày,240.000,,,Hải Phòng,4,https://www.lazada.vn/products/tinh-chat-lam-trang-sach-tan-nhang-kem-het-nam-tan-nhang-cao-cap-nuoi-duong-da-100ml-cam-ket-het-nam-sam-da-trong-7-ngay-i2239584883.html
Tinh chất làm trắng sạch tàn nhang Serum Dưỡng Trắng Da Mặt Chính Hãng 100ml Loại Bỏ Tàn Nhang Hiệu Quả Chống Nhăn Dưỡng Ẩm Nuôi Dưỡng Da Giảm Melanin Làm Sáng Đều Màu Da Chống Lão Hóa,240.000,,9,Hải Phòng,5,https://www.lazada.vn/products/tinh-chat-lam-trang-sach-tan-nhang-serum-duong-trang-da-mat-chinh-hang-100ml-loai-bo-tan-nhang-hieu-qua-chong-nhan-duong-am-nuoi-duong-da-giam-melanin-lam-sang-deu-mau-da-chong-lao-hoa-i2171930436.html
Serum Thảo Mộc Xanh Dưỡng Da X5 Hàng Chính Hãng,65.000,,53,Đà Nẵng,5,https://www.lazada.vn/products/serum-thao-moc-xanh-duong-da-x5-hang-chinh-hang-i2192885945.html
"Kem dưỡng da mờ thâm nám, tàn nhang FIXDERMA SKARFIX -TX Cream 15gr [Hàng chính hãng]",270.000,,,Yên Bái,1,https://www.lazada.vn/products/kem-duong-da-mo-tham-nam-tan-nhang-fixderma-skarfix-tx-cream-15gr-hang-chinh-hang-i1413964802.html
"Đá Gua Sha Massage Mặt Bằng Thạch Anh Cao Cấp Giúp Lưu Thông Máu Hỗ Trợ Nâng Cơ, Giảm Nếp Nhăn, Thẩm Thấu Các Loại Dưỡng Da, Giúp Da Thư Giãn Hồng Hào, Căng Mịn",119.000,,27,Hồ Chí Minh,9,https://www.lazada.vn/products/da-gua-sha-massage-mat-bang-thach-anh-cao-cap-giup-luu-thong-mau-ho-tro-nang-co-giam-nep-nhan-tham-thau-cac-loai-duong-da-giup-da-thu-gian-hong-hao-cang-min-i2403687185.html
Serum siêu căng bóng dưỡng trắng chống nhăn 120ml Serum tinh chất dưỡng giúp da siêu căng bóng trẻ hoá làn da Tinh chất làm trắng,159.000,,,Hải Phòng,2,https://www.lazada.vn/products/serum-sieu-cang-bong-duong-trang-chong-nhan-120ml-serum-tinh-chat-duong-giup-da-sieu-cang-bong-tre-hoa-lan-da-tinh-chat-lam-trang-i2269784943.html
KEM DƯỠNG DA B5 LAROCHE POSAY,59.000,,31,Hà Nội,26,https://www.lazada.vn/products/kem-duong-da-b5-laroche-posay-i2052594896.html
Serum dưỡng da Luxury gold serum Plus Detox White,450.000,,7,Hưng Yên,1,https://www.lazada.vn/products/serum-duong-da-luxury-gold-serum-plus-detox-white-i2159175622.html
"Serum CUTISCURA, Tế bào gốc CUTISCURA trắng da giảm mụn nám sẹo chăm sóc da mặt dưỡng ẩm căng bóng Hàn Quốc",18.500,,137,Hà Nội,4,https://www.lazada.vn/products/serum-cutiscura-te-bao-goc-cutiscura-trang-da-giam-mun-nam-seo-cham-soc-da-mat-duong-am-cang-bong-han-quoc-i2251716254.html
"Mặt nạ dưỡng da nhau thai cừu - Dưỡng ẩm, sáng da, se khít lỗ chân lông",6.000,,335,Hồ Chí Minh,92,https://www.lazada.vn/products/mat-na-duong-da-nhau-thai-cuu-duong-am-sang-da-se-khit-lo-chan-long-i2185927917.html
Mặt nạ nilong ủ tê dưỡng ẩm gói 100 miếng,6.000,,334,Hà Nội,24,https://www.lazada.vn/products/mat-na-nilong-u-te-duong-am-goi-100-mieng-i2132871998.html
【Loại bỏ tàn nhang nhanh chóng】Kem làm trắng da hiệu quả 20g loại bỏ tàn nhang kem dưỡng ẩm chăm sóc da mặt loại bỏ đốm đen làm trắng kem chống nắng Chăm sóc Da trắng sáng Tự nhiên/whitening freckle cream,116.000,,254,Hải Phòng,59,https://www.lazada.vn/products/loai-bo-tan-nhang-nhanh-chongkem-lam-trang-da-hieu-qua-20g-loai-bo-tan-nhang-kem-duong-am-cham-soc-da-mat-loai-bo-dom-den-lam-trang-kem-chong-nang-cham-soc-da-trang-sang-tu-nhienwhitening-freckle-cream-i2166985257.html
Mặt Nạ Trái Cây Bioaqua Dưỡng Trắng Cấp Ẩm Căng Bóng- Cung Cấp Vitamin Cho Làn Da Khỏe Đẹp,2.786,,269,Hồ Chí Minh,14,https://www.lazada.vn/products/mat-na-trai-cay-bioaqua-duong-trang-cap-am-cang-bong-cung-cap-vitamin-cho-lan-da-khoe-dep-i1979912056.html
HOÀN TIỀN 15% - Kem Dưỡng Da Retinol K Lady Care Derm Actip - 30ml,145.000,,999,Hà Nội,195,https://www.lazada.vn/products/hoan-tien-15-kem-duong-da-retinol-k-lady-care-derm-actip-30ml-i2250500670.html
"FREE SHIP- Derma Forte 15g - Bản Thường / Advanced, Gel Giúp Giảm Mụn Trứng Cá, Ngừa Thâm, Mờ Sẹo, Dưỡng Da",64.000,,117,Long An,19,https://www.lazada.vn/products/free-ship-derma-forte-15g-ban-thuong-advanced-gel-giup-giam-mun-trung-ca-ngua-tham-mo-seo-duong-da-i2142135321.html
Kem Dưỡng Da Retinol K Lady Care Derm Actip - 30ml,115.000,,1.4K,Ninh Bình,255,https://www.lazada.vn/products/kem-duong-da-retinol-k-lady-care-derm-actip-30ml-i2249879673.html
[Mua 3 Tang 1]Tinh chất dưỡng da Kim Baby Face HA+ cao cấp serum Kim Baby Face HA+,375.000,,2.4K,Hà Nội,550,https://www.lazada.vn/products/mua-3-tang-1tinh-chat-duong-da-kim-baby-face-ha-cao-cap-serum-kim-baby-face-ha-i1809171820.html
"Sữa rửa mặt ngăn ngừa mụn, dưỡng trắng da Lrocre 100g",115.000,,59,Đăk Lăk,5,https://www.lazada.vn/products/sua-rua-mat-ngan-ngua-mun-duong-trang-da-lrocre-100g-i1767633513.html
Kem dưỡng trắng và tái tạo da V7,22.222,,427,Hà Nội,57,https://www.lazada.vn/products/kem-duong-trang-va-tai-tao-da-v7-i2178593139.html
"Đá Gua Sha Massage Mặt Bằng Thạch Anh Cao Cấp Giúp Lưu Thông Máu Hỗ Trợ Nâng Cơ, Giảm Nếp Nhăn, Thẩm Thấu Các Loại Dưỡng Da, Giúp Da Thư Giãn Hồng Hào, Căng Mịn",119.000,,82,Hồ Chí Minh,24,https://www.lazada.vn/products/da-gua-sha-massage-mat-bang-thach-anh-cao-cap-giup-luu-thong-mau-ho-tro-nang-co-giam-nep-nhan-tham-thau-cac-loai-duong-da-giup-da-thu-gian-hong-hao-cang-min-i2403625493.html
Serum Dưỡng Da HM Store,295.000,,17,Hồ Chí Minh,6,https://www.lazada.vn/products/serum-duong-da-hm-store-i1877958129.html
[HCM]Glamour Axit Hyaluronic Serum Dưỡng Da Mặt Chống Lão Hóa Thu Nhỏ Lỗ Chân Lông Làm Trắng Da Tinh Chất Dưỡng Ẩm Da Mặt chăm Sóc Da Khô 15 Ml,69.000,,69,Hồ Chí Minh,17,https://www.lazada.vn/products/hcmglamour-axit-hyaluronic-serum-duong-da-mat-chong-lao-hoa-thu-nho-lo-chan-long-lam-trang-da-tinh-chat-duong-am-da-mat-cham-soc-da-kho-15-ml-i1530567983.html
Kem Dưỡng Da La Roche-Posay Làm Dịu Kích Ứng & Phục Hồi Da B5,89.000,,12,Hà Nội,11,https://www.lazada.vn/products/kem-duong-da-la-roche-posay-lam-diu-kich-ung-phuc-hoi-da-b5-i2176667774.html
"DELEVENTH Axit lactobionic Tinh Chất Pore Refining Tinh Chất Dưỡng Da Mặt Thu nhỏ lỗ chân lông Chống lão hóa,Serum Ngăn Ngừa Mụn DELEVENTH [FREESHIP] Thu Nhỏ Lỗ Chân Lông Cấp Ẩm Làm Sáng Da",69.000,,186,Hồ Chí Minh,64,https://www.lazada.vn/products/deleventh-axit-lactobionic-tinh-chat-pore-refining-tinh-chat-duong-da-mat-thu-nho-lo-chan-long-chong-lao-hoaserum-ngan-ngua-mun-deleventh-freeship-thu-nho-lo-chan-long-cap-am-lam-sang-da-i2016550264.html
Kem Dưỡng Phục Hồi Từ Sâu Bên Trong Da Skin1004,79.500,,19,Hà Nội,20,https://www.lazada.vn/products/kem-duong-phuc-hoi-tu-sau-ben-trong-da-skin1004-i2170789197.html
"Kem Phức Hợp DR-RASHEL Dưỡng Trắng Da, Ngăn Ngừa Nam, Hết Nám Tàn Nhan Cao Cấp Nuôi dưỡng Da trắng sáng đều màu giữ ẩm từ sâu bên trong Whitening Cream",153.000,,2.7K,Hà Nội,573,https://www.lazada.vn/products/kem-phuc-hop-dr-rashel-duong-trang-da-ngan-ngua-nam-het-nam-tan-nhan-cao-cap-nuoi-duong-da-trang-sang-deu-mau-giu-am-tu-sau-ben-trong-whitening-cream-i1330119983.html
Mặt Nạ Giấy Các Loại ( Nạ Ha)(Nạ Nhau Thai)(Nạ Thủy Tinh) Dưỡng Da Trăng Da Cấp Ẩm Se Khít Lỗ Chân Lông Mờ Thâm,3.500,,50,Hà Nội,8,https://www.lazada.vn/products/mat-na-giay-cac-loai-na-hana-nhau-thaina-thuy-tinh-duong-da-trang-da-cap-am-se-khit-lo-chan-long-mo-tham-i2503401294.html
"Mặt nạ nhau thai cừu chính hãng, mask dưỡng da cấp ẩm cho da hanh khô nứt nẻ, dưỡng trắng da mịn màng mùa khô nẻ",5.900,,5,Hà Nội,1,https://www.lazada.vn/products/mat-na-nhau-thai-cuu-chinh-hang-mask-duong-da-cap-am-cho-da-hanh-kho-nut-ne-duong-trang-da-min-mang-mua-kho-ne-i2121234201.html
Mặt nạ ngủ dưỡng da trắng da dưỡng ẩm ha sữa đào NaCleverr,5.800,,11,Hà Nội,4,https://www.lazada.vn/products/mat-na-ngu-duong-da-trang-da-duong-am-ha-sua-dao-nacleverr-i2134508807.html
"Serum giảm mụn dưỡng da Black Sugar Nhật Bản, tinh chất căng bóng, mờ thâm",85.000,,65,Hải Phòng,8,https://www.lazada.vn/products/serum-giam-mun-duong-da-black-sugar-nhat-ban-tinh-chat-cang-bong-mo-tham-i651124845.html
[HCM]Kem berry plus extra whitening cream 5x dưỡng da giảm nám tàn nhang thái lan 20 gam,123.000,,255,An Giang,37,https://www.lazada.vn/products/hcmkem-berry-plus-extra-whitening-cream-5x-duong-da-giam-nam-tan-nhang-thai-lan-20-gam-i1358108522.html
"Tinh chất dưỡng da giúp làm dịu, làm mát& phục hồi da Luxi Skin phù hợp da sau tái tạo",128.000,,11,Bà Rịa Vũng Tàu,2,https://www.lazada.vn/products/tinh-chat-duong-da-giup-lam-diu-lam-mat-phuc-hoi-da-luxi-skin-phu-hop-da-sau-tai-tao-i2017966160.html
[ Hàng chính hãng] SERUM DƯỠNG DA MỜ THÂM ĐA NĂNG PHÚC MINH TÂM (1 lo 30ml date 2026)( Mua 2 hộp Serum Tặng 1 Gel Tẩy tế bào chết Phúc Minh Tâm 20g),150.000,,38,Lâm Đồng,5,https://www.lazada.vn/products/hang-chinh-hang-serum-duong-da-mo-tham-da-nang-phuc-minh-tam-1-lo-30ml-date-2026-mua-2-hop-serum-tang-1-gel-tay-te-bao-chet-phuc-minh-tam-20g-i1588910517.html
"{FREESHIP TẶNG QUÀ 39K} Sữa rửa mặt dưỡng ẩm bảo vệ da,loại bỏ bui bẩn giúp da tươi sáng Cleanser Karmel",299.000,,169,Hà Nội,30,https://www.lazada.vn/products/freeship-tang-qua-39k-sua-rua-mat-duong-am-bao-ve-daloai-bo-bui-ban-giup-da-tuoi-sang-cleanser-karmel-i2150081022.html
Kem Dưỡng Da Phục Hồi Da Rau Má Skin1004,89.000,,9,Hà Nội,8,https://www.lazada.vn/products/kem-duong-da-phuc-hoi-da-rau-ma-skin1004-i2176786341.html
Sữa Rửa Mặt Axit Amin Làm Sạch Nhẹ Nhàng Kiểm Soát Dầu Giảm Mụn Đầu Đen Loại bỏ ve nhẹ nhàng Rửa và tẩy trang hợp nhất dưỡng da thực vật thu nhỏ lỗ chân lông 120g,135.000,,,Hải Phòng,2,https://www.lazada.vn/products/sua-rua-mat-axit-amin-lam-sach-nhe-nhang-kiem-soat-dau-giam-mun-dau-den-loai-bo-ve-nhe-nhang-rua-va-tay-trang-hop-nhat-duong-da-thuc-vat-thu-nho-lo-chan-long-120g-i2135645509.html
"Sữa rửa mặt ngăn ngừa mụn, dưỡng trắng da Lrocre 100g[Chính Hãng]",105.000,,6,Đăk Lăk,1,https://www.lazada.vn/products/sua-rua-mat-ngan-ngua-mun-duong-trang-da-lrocre-100gchinh-hang-i1628119360.html
"Kem Dưỡng Da Huxley Ngừa Lão Hóa, Cải Thiện Nếp Nhăn",79.000,,,Hà Nội,1,https://www.lazada.vn/products/kem-duong-da-huxley-ngua-lao-hoa-cai-thien-nep-nhan-i2103604361.html
"Kem Mụn Queenie Skin Dưỡng Da Trắng Mịn, Sạch Mụn Mờ Thâm",279.000,,26,Hồ Chí Minh,5,https://www.lazada.vn/products/kem-mun-queenie-skin-duong-da-trang-min-sach-mun-mo-tham-i1369751289.html
"Máy Massage Mặt Đẩy Tinh Chất Cầm Tay Cao Cấp-Máy Đẩy Tinh Chất Điện Di Ion Dưỡng Da Mặt, Làm Sạch Sáng Da, Giúp Thẩm Thấu Tinh Chất - Dụng Cụ Massage Nâng Cơ Mặt, Trẻ Hóa Làn Da, Chăm Sóc Da Mặt Chuyên Sâu - Smart Tech 4.",389.000,,2.7K,Hà Nội,166,https://www.lazada.vn/products/may-massage-mat-day-tinh-chat-cam-tay-cao-cap-may-day-tinh-chat-dien-di-ion-duong-da-mat-lam-sach-sang-da-giup-tham-thau-tinh-chat-dung-cu-massage-nang-co-mat-tre-hoa-lan-da-cham-soc-da-mat-chuyen-sau-smart-tech-4-i2068614970.html
"QUẾ HOA MỤN QUEENIESKIN_ KEM DƯỠNG DA LÀM XẸP MỤN NHANH, LIỀN SẸO RỖ, MỜ THÂM SẠM, DƯỠNG TRẮNG DA MẶT",172.000,,5,Hồ Chí Minh,2,https://www.lazada.vn/products/que-hoa-mun-queenieskin_-kem-duong-da-lam-xep-mun-nhanh-lien-seo-ro-mo-tham-sam-duong-trang-da-mat-i2095154569.html
Sản phẩm dưỡng da Acnaut Active,449.000,,,Hà Nội,2,https://www.lazada.vn/products/san-pham-duong-da-acnaut-active-i2118184135.html
"Máy Xông Hơi Nước Dưỡng Da Mini Maoer, Magic 2 in 1, Máy Xông Mặt Hoa Quả, Máy Xông Hơi Thảo Dược, Tinh Dầu An Toàn Tiện Dụng",55.000,,488,Hồ Chí Minh,99,https://www.lazada.vn/products/may-xong-hoi-nuoc-duong-da-mini-maoer-magic-2-in-1-may-xong-mat-hoa-qua-may-xong-hoi-thao-duoc-tinh-dau-an-toan-tien-dung-i2547333324.html
"[ CHÍNH HÃNG] Bộ đôi dưỡng da trắng sáng mịn màng Toner và Emulsion Nhau Thai Cừu VSHELL Dưỡng Ẩm Trắng Da, Bộ Chăm Sóc Da Nhau Thai Cừu Dưỡng Ẩm Trắng Da",146.000,,13,Hà Nội,9,https://www.lazada.vn/products/chinh-hang-bo-doi-duong-da-trang-sang-min-mang-toner-va-emulsion-nhau-thai-cuu-vshell-duong-am-trang-da-bo-cham-soc-da-nhau-thai-cuu-duong-am-trang-da-i2208086116.html
[HCM]Kem dưỡng trắng ngừa mụn demejine hàn quốc chuyên mụn thâm trắng da,79.000,,215,Hồ Chí Minh,26,https://www.lazada.vn/products/hcmkem-duong-trang-ngua-mun-demejine-han-quoc-chuyen-mun-tham-trang-da-i1199546990.html
Mặt nạ làm trắng Niacinamide làm sáng đều màu da Xóa vết thâm Mặt nạ ngủ thạch Mặt nạ ngủ dưỡng ẩm,79.000,,417,Hải Phòng,106,https://www.lazada.vn/products/mat-na-lam-trang-niacinamide-lam-sang-deu-mau-da-xoa-vet-tham-mat-na-ngu-thach-mat-na-ngu-duong-am-i2277675692.html
"Máy Phun Sương Xông Hơi Mặt NaNo Mini Cầm Tay Hỗ Trợ Dưỡng Da Cấp Nước Cân Bằng Độ Ẩm Dưỡng Da, Chống Lão Hóa Khô Da- Máy phun sương tạo ẩm khếch tán tinh dầu G.DSPS17",29.900,,,Phú Yên,2,https://www.lazada.vn/products/maacutey-phun-suong-xocircng-hoi-mat-nano-mini-cam-tay-ho-tro-duong-da-cap-nuoc-cacircn-bang-do-am-duong-da-chong-latildeo-hoacutea-khocirc-da-maacutey-phun-suong-tao-am-khech-taacuten-tinh-dau-gdsps17-i1459909365.html
"Cốc tạo bọt sữa rửa mặt, dầu gội dưỡng da OTW",29.000,,11,Hồ Chí Minh,2,https://www.lazada.vn/products/coc-tao-bot-sua-rua-mat-dau-goi-duong-da-otw-i2054979394.html
