ProductName,ProductPrice,ProductDiscount,ProductSold,ProductAddress,ProductReviewCount,Productlink
[CHÍNH HÃNG] Sữa Rửa Mặt Dưỡng Trắng Da Tinh Chất Chanh Civic 180g Thái Lan,45.000,,,Hồ Chí Minh,1,https://www.lazada.vn/products/chinh-hang-sua-rua-mat-duong-trang-da-tinh-chat-chanh-civic-180g-thai-lan-i2277682422.html
Combo Cetaphil Sữa Rửa Mặt 500ml + Kem Dưỡng Ẩm 550g sửa rửa mặt cetaphil kem dưỡng cetaphil,218.000,,9,Hồ Chí Minh,4,https://www.lazada.vn/products/combo-cetaphil-sua-rua-mat-500ml-kem-duong-am-550g-sua-rua-mat-cetaphil-kem-duong-cetaphil-i2293601125.html
DEleventh Kem Làm Trắng Da Mặt Tự Nhiên giúp làm mờ nếp nhăn lão hóa DELEVENTH Pearl aqua Sữa Dưỡng Da Mặt Dưỡng trắng,79.000,,31,Hồ Chí Minh,27,https://www.lazada.vn/products/deleventh-kem-lam-trang-da-mat-tu-nhien-giup-lam-mo-nep-nhan-lao-hoa-deleventh-pearl-aqua-sua-duong-da-mat-duong-trang-i2201118734.html
Agdoad Mặt Nạ Đất Sét Làm Sạch Trà Xanh Mặt Nạ VC Làm Sạch Mụn Dưỡng Ẩm Làm Sạch Da Mặt Than Tre Làm Trắng Da Mặt,27.400,,183,Nước ngoài,23,https://www.lazada.vn/products/agdoad-mat-na-dat-set-lam-sach-tra-xanh-mat-na-vc-lam-sach-mun-duong-am-lam-sach-da-mat-than-tre-lam-trang-da-mat-i1713470874.html
[MẪU MỚI][Saigon Scent] Kem dưỡng RoC Retinol Correxion Deep Wrinkle Night Cream ( 30mL ),393.000,,140,Hồ Chí Minh,28,https://www.lazada.vn/products/mau-moisaigon-scent-kem-duong-roc-retinol-correxion-deep-wrinkle-night-cream-30ml-i467048372.html
SP SỈ THẢO DƯỢC Serum nghệ tây saffon 30ml Sunary dưỡng ẩm cang bóng trắng hồng sau tái tạo tinh chất thiên nhiên Tăng sức đề kháng cho da tạo lớp màng bảo vệ da trước tác động của môi trường,92.000,,118,Hồ Chí Minh,19,https://www.lazada.vn/products/sp-si-thao-duoc-serum-nghe-tay-saffon-30ml-sunary-duong-am-cang-bong-trang-hong-sau-tai-tao-tinh-chat-thien-nhien-tang-suc-de-khang-cho-da-tao-lop-mang-bao-ve-da-truoc-tac-dong-cua-moi-truong-i1432931000.html
Sữa rửa mặt chống lão hóa da Hada Labo Anti Aging chứa Collagen - srm Hadalabo tuýp 80g ngừa nám tàn nhang,89.000,,60,Hà Nội,11,https://www.lazada.vn/products/sua-rua-mat-chong-lao-hoa-da-hada-labo-anti-aging-chua-collagen-srm-hadalabo-tuyp-80g-ngua-nam-tan-nhang-i669046090.html
Mặt nạ unifon peptide dưỡng ẩm làm săn chắc và sửa chữa làm mờ nếp nhăn da mặt,69.000,,28,Hồ Chí Minh,8,https://www.lazada.vn/products/mat-na-unifon-peptide-duong-am-lam-san-chac-va-sua-chua-lam-mo-nep-nhan-da-mat-i2040022057.html
mặt nạ ngủ Bioaqua dưỡng ẩm da se khít lỗ chân lông,12.500,,,Khánh Hòa,0,https://www.lazada.vn/products/mat-na-ngu-bioaqua-duong-am-da-se-khit-lo-chan-long-i2203181408.html
Kem Retinol KLady Care Dưỡng Trắng Cấp ẩm .Làm Mờ Thâm Nám,99.000,,5,Hà Nội,4,https://www.lazada.vn/products/kem-retinol-klady-care-duong-trang-cap-am-lam-mo-tham-nam-i2315083245.html
"Serum La Roche B5 hyalu phục hồi, dưỡng ẩm",79.000,,,Hà Nội,3,https://www.lazada.vn/products/serum-la-roche-b5-hyalu-phuc-hoi-duong-am-i2191849309.html
Mặt Nạ Trà Xanh Lột Mụn Đầu Đen Dưỡng Ẩm Cân Bằng Dầu Cho Da,65.000,,10,Hà Nội,2,https://www.lazada.vn/products/mat-na-tra-xanh-lot-mun-dau-den-duong-am-can-bang-dau-cho-da-i2235893114.html
[Hàng Chính Hãng 100% Thái Lan 4K Plus 5X] Kem face trừ nám dưỡng trắng da 4k plus 5x Thái Lan Berry Plus Extra Whitening Cream,120.000,,23,Hồ Chí Minh,4,https://www.lazada.vn/products/hang-chinh-hang-100-thai-lan-4k-plus-5x-kem-face-tru-nam-duong-trang-da-4k-plus-5x-thai-lan-berry-plus-extra-whitening-cream-i688658971.html
Kem dưỡng trắng da Huxley Cream Trắng sáng ra căng bóng,79.000,,19,Hà Nội,5,https://www.lazada.vn/products/kem-duong-trang-da-huxley-cream-trang-sang-ra-cang-bong-i2117691851.html
"KEM DƯỠNG DA , NGỪA MỤN KISSMI -N 10G",35.000,,46,Hà Nội,3,https://www.lazada.vn/products/kem-duong-da-ngua-mun-kissmi-n-10g-i275584591.html
Kem dưỡng trắng da mặt dưỡng ẩm dưỡng trắng ngày đêm V7 Image - RubyLida,32.000,,5,Hà Nội,2,https://www.lazada.vn/products/kem-duong-trang-da-mat-duong-am-duong-trang-ngay-dem-v7-image-rubylida-i2145785682.html
"Kem bôi trắng da mặt kem tẩy trắng da cấp tốc xóa vết thâm nám, làm trắng da",77.000,,50,Nước ngoài,13,https://www.lazada.vn/products/kem-boi-trang-da-mat-kem-tay-trang-da-cap-toc-xoa-vet-tham-nam-lam-trang-da-i2346312742.html
[HCM]Combo 2 Chai Cốt Nghệ Hạt Gấc Hạ Thổ Cho Mặt và Body (500ml) | Hạ Thổ 3 Tháng 10 Ngày | Dưỡng Sáng Trắng Mịn Da | ruo gung ha tho cot gung nghe hat gac ha tho thoa ruou gung nghe sau sinh,215.000,,23,Hồ Chí Minh,6,https://www.lazada.vn/products/hcmcombo-2-chai-cot-nghe-hat-gac-ha-tho-cho-mat-va-body-500ml-ha-tho-3-thang-10-ngay-duong-sang-trang-min-da-ruo-gung-ha-tho-cot-gung-nghe-hat-gac-ha-tho-thoa-ruou-gung-nghe-sau-sinh-i969244115.html
"Ngọc cạo gió mặt giúp giảm nếp nhăn, làm đẹp - 1 miếng",35.000,,16,Hà Nội,1,https://www.lazada.vn/products/ngoc-cao-gio-mat-giup-giam-nep-nhan-lam-dep-1-mieng-i2131874072.html
"[Mua 2 tặng 1] kem xóa nám làm trắng da tinh chất kem dưỡng da mặt collagen Tinh chất sóc da làm mờ tàn nhang có hiệu quả 20g,Kem Hỗ trợ giảm tàn nhang Làm Trắng Da Dưỡng Ẩm Dễ Sử Dụng Dành Cho Nam Và Nữ",80.000,,5,Hồ Chí Minh,3,https://www.lazada.vn/products/mua-2-tang-1-kem-xoa-nam-lam-trang-da-tinh-chat-kem-duong-da-mat-collagen-tinh-chat-soc-da-lam-mo-tan-nhang-co-hieu-qua-20gkem-ho-tro-giam-tan-nhang-lam-trang-da-duong-am-de-su-dung-danh-cho-nam-va-nu-i2191394665.html
Kem dưỡng ẩm Vaseline dừa 30gr,55.000,,13,Hà Nội,2,https://www.lazada.vn/products/kem-duong-am-vaseline-dua-30gr-i931756805.html
[Hàng Chính Hãng] YANJIAYI Mặt nạ ngủ Collagen Hàn Quốc gốc bù nước chặt chẽ một phần tinh chất ngủ axit salicylic 20 miếng mỗi hộp,390.000,,21,Hồ Chí Minh,15,https://www.lazada.vn/products/hang-chinh-hang-yanjiayi-mat-na-ngu-collagen-han-quoc-goc-bu-nuoc-chat-che-mot-phan-tinh-chat-ngu-axit-salicylic-20-mieng-moi-hop-i2078836216.html
"Gel rửa mặt tinh chất Nho Pháp MALDALA dưỡng ẩm, dịu nhẹ thích hợp cho da nhạy cảm 180ml",99.000,,27,Hồ Chí Minh,3,https://www.lazada.vn/products/gel-rua-mat-tinh-chat-nho-phap-maldala-duong-am-diu-nhe-thich-hop-cho-da-nhay-cam-180ml-i2190672108.html
"Mặt nạ đào và bơ trắng da, dưỡng ẩm BIOAQUA",3.200,,7,Hồ Chí Minh,1,https://www.lazada.vn/products/mat-na-dao-va-bo-trang-da-duong-am-bioaqua-i2218290245.html
Kem Dưỡng Da Pond's Sáng Hồng Rạng Rỡ Cho Ban Ngày/ Đêm 50g Ponds,135.000,,6,Hồ Chí Minh,3,https://www.lazada.vn/products/kem-duong-da-ponds-sang-hong-rang-ro-cho-ban-ngay-dem-50g-ponds-i2158065769.html
[Chính Hãng]Kem face dưỡng trắng da mờ nám Bạch Ngọc Liên (20g) thế hệ mới,169.000,,8,Hồ Chí Minh,2,https://www.lazada.vn/products/chinh-hangkem-face-duong-trang-da-mo-nam-bach-ngoc-lien-20g-the-he-moi-i2112210563.html
"Sữa rửa mặt axit amin BIOAQUA, loại bỏ mụn trứng cá, thích hợp cho da mụn dầu, loại bỏ mụn trứng cá và tế bào da chết, dưỡng ẩm và thu nhỏ lỗ chân lông, thích hợp cho nam giới và phụ nữ 100g",148.000,,,Hồ Chí Minh,3,https://www.lazada.vn/products/sua-rua-mat-axit-amin-bioaqua-loai-bo-mun-trung-ca-thich-hop-cho-da-mun-dau-loai-bo-mun-trung-ca-va-te-bao-da-chet-duong-am-va-thu-nho-lo-chan-long-thich-hop-cho-nam-gioi-va-phu-nu-100g-i2119714279.html
[HCM][Đủ Mùi] Kem Dưỡng Da Tay Bath And Body Works - Hand Cream (29ml),99.000,,15,Hồ Chí Minh,1,https://www.lazada.vn/products/hcmdu-mui-kem-duong-da-tay-bath-and-body-works-hand-cream-29ml-i871246383.html
"Combo 02 Tuýp Sữa rửa mặt gạo dưỡng ẩm, trắng sáng da Civic Rice milk Thái Lan 180ml",45.000,,,Hồ Chí Minh,1,https://www.lazada.vn/products/combo-02-tuyp-sua-rua-mat-gao-duong-am-trang-sang-da-civic-rice-milk-thai-lan-180ml-i2159209706.html
"[Chính hãng] Tinh Chất Dưỡng Trắng, Làm Sáng Da Tiam Vita B3 Source 40ml",239.000,,11,Hà Nội,2,https://www.lazada.vn/products/chinh-hang-tinh-chat-duong-trang-lam-sang-da-tiam-vita-b3-source-40ml-i1470869641.html
"( mua 7 tặng 1) hộp 100gr Mặt nạ cao tinh nghệ ngân bình, mặt nạ thải độc da, dưỡng da mặt , thu nhỏ lỗ chân lông, mặt nạ ngủ khử thâm mụn, mờ nám",38.500,,21,Thừa Thiên Huế,4,https://www.lazada.vn/products/mua-7-tang-1-hop-100gr-mat-na-cao-tinh-nghe-ngan-binh-mat-na-thai-doc-da-duong-da-mat-thu-nho-lo-chan-long-mat-na-ngu-khu-tham-mun-mo-nam-i1031866849.html
Kem dưỡng trắng da ban ngày Zidi,500.000,,5,Hà Nội,3,https://www.lazada.vn/products/kem-duong-trang-da-ban-ngay-zidi-i1320996162.html
"Kem dưỡng ẩm CeraVe Moisturizing Cream cho mặt và toàn thân, phục hồi và nuôi dưỡng làn da_ 236ml",65.000,,116,Hồ Chí Minh,32,https://www.lazada.vn/products/kem-duong-am-cerave-moisturizing-cream-cho-mat-va-toan-than-phuc-hoi-va-nuoi-duong-lan-da_-236ml-i1515276123.html
Sữa rửa mặt Cerave giúp làm sạch sâu dành cho da dầu Cerave Foaming Facial Cleans Da dầu236ML,40.000,,,Hồ Chí Minh,1,https://www.lazada.vn/products/sua-rua-mat-cerave-giup-lam-sach-sau-danh-cho-da-dau-cerave-foaming-facial-cleans-da-dau236ml-i2091829920.html
"Serum Medic Roller Compact Essencea 10ml Serum làm giảm mụn ẩn, mụn đầu đen, mụn bọc, kháng viêm, kháng khuẩn giảm nhờn, dưỡng da, se khít lỗ chân lông.",599.000,,207,Hà Nội,116,https://www.lazada.vn/products/serum-medic-roller-compact-essencea-10ml-serum-lam-giam-mun-an-mun-dau-den-mun-boc-khang-viem-khang-khuan-giam-nhon-duong-da-se-khit-lo-chan-long-i2200672682.html
Kem Dưỡng The Ordinary Vitamin C Suspension 23% +HA Spheres 2% 30ml_Giúp Trắng Sáng Da_Mờ Thâm,70.000,,10,Hồ Chí Minh,5,https://www.lazada.vn/products/kem-duong-the-ordinary-vitamin-c-suspension-23-ha-spheres-2-30ml_giup-trang-sang-da_mo-tham-i2273643501.html
"Gel Diếp Cá Tái Sinh Meea Organic 120g Đắp Mặt , Mờ Thâm Nám , Dưỡng Trắng , Ngăn Ngừa Mụn ,Kháng Khuẩn, Dụng Cụ Chăm Sóc Da Mặt Hiệu Quả",53.000,,5,Hồ Chí Minh,1,https://www.lazada.vn/products/gel-diep-ca-tai-sinh-meea-organic-120g-dap-mat-mo-tham-nam-duong-trang-ngan-ngua-mun-khang-khuan-dung-cu-cham-soc-da-mat-hieu-qua-i2063357219.html
Mặt nạ sủi bọt rau má GINBI thải độc cấp ẩm dưỡng trắng da - RubyLida,35.000,,,Hà Nội,1,https://www.lazada.vn/products/mat-na-sui-bot-rau-ma-ginbi-thai-doc-cap-am-duong-trang-da-rubylida-i2145401242.html
Sữa Rửa Mặt Dành Cho Da Mụn Senka Perfect Whip Acne Care 100g,35.000,,299,Hồ Chí Minh,50,https://www.lazada.vn/products/sua-rua-mat-danh-cho-da-mun-senka-perfect-whip-acne-care-100g-i2064602856.html
Sữa rửa mặt dưỡng trắng Hada Labo Perfect White Cleanser 80g,68.000,,26,Hồ Chí Minh,6,https://www.lazada.vn/products/sua-rua-mat-duong-trang-hada-labo-perfect-white-cleanser-80g-i995850252.html
[COMBO]Sữa Rửa Mặt Images và Kem Dưỡng Trắng Da V7 Thu Nhỏ Lỗ Chân Lông - RubyLida,49.000,,,Hà Nội,1,https://www.lazada.vn/products/combosua-rua-mat-images-va-kem-duong-trang-da-v7-thu-nho-lo-chan-long-rubylida-i2145206207.html
Sữa rửa mặt dưỡng chuyên biệt chống lão hóa Hada Labo Pro Anti Aging Cleanser 80g,78.000,,48,Hồ Chí Minh,4,https://www.lazada.vn/products/sua-rua-mat-duong-chuyen-biet-chong-lao-hoa-hada-labo-pro-anti-aging-cleanser-80g-i995864324.html
HOÀN TIỀN 20% - Sữa rửa mặt Truffle trắng sạch mụn Sữa rửa mặt dưỡng trắng Sữa rửa mặt axit amin 7 sạch mụn nhanh chóng Dưỡng trắng giữ ẩm Tinh chất Truffle trắng thu nhỏ lỗ chân lông Mịn màng không căng tức Nam nữ thông dụng 500ML,290.000,,17,Hải Phòng,16,https://www.lazada.vn/products/hoan-tien-20-sua-rua-mat-truffle-trang-sach-mun-sua-rua-mat-duong-trang-sua-rua-mat-axit-amin-7-sach-mun-nhanh-chong-duong-trang-giu-am-tinh-chat-truffle-trang-thu-nho-lo-chan-long-min-mang-khong-cang-tuc-nam-nu-thong-dung-500ml-i2312246135.html
"Mặt nạ dưỡng da diếp cá, giảm mụn, thải độc, giảm sưng đỏ, SỈ IB",160.000,,49,Hồ Chí Minh,16,https://www.lazada.vn/products/mat-na-duong-da-diep-ca-giam-mun-thai-doc-giam-sung-do-si-ib-i1657483509.html
"Sữa Rửa Mặt Làm Trắng Da 168ml, Ngừa Mụn Trẻ Hóa , Kiểm Soát Dầu, Dưỡng Ẩm Lấy Sạch Bụi Bẩn",39.000,,44,Nước ngoài,19,https://www.lazada.vn/products/sua-rua-mat-lam-trang-da-168ml-ngua-mun-tre-hoa-kiem-soat-dau-duong-am-lay-sach-bui-ban-i2016831999.html
"lô hội làm dịu ngưng tụ 30g, kem dưỡng ẩm da và mặt nạ dưỡng ẩm mặt, Aloe Vera và Vitamin E làm dịu gel dưỡng ẩm cho tất cả da",58.000,,143,Hồ Chí Minh,49,https://www.lazada.vn/products/lo-hoi-lam-diu-ngung-tu-30g-kem-duong-am-da-va-mat-na-duong-am-mat-aloe-vera-va-vitamin-e-lam-diu-gel-duong-am-cho-tat-ca-da-i2132335914.html
Combo 2 hộp Kem Dưỡng Da Ngày Và Đêm Trắng Hồng Rạng Rỡ Pond's White Beauty (30g),182.000,,246,Hồ Chí Minh,60,https://www.lazada.vn/products/combo-2-hop-kem-duong-da-ngay-va-dem-trang-hong-rang-ro-ponds-white-beauty-30g-i601266017.html
Kem 4K Plus Thái Lan Chính Hãng 100% Dưỡng Trắng Da Căng Bóng Ban Đêm 20gr,107.000,,164,Hồ Chí Minh,26,https://www.lazada.vn/products/kem-4k-plus-thai-lan-chinh-hang-100-duong-trang-da-cang-bong-ban-dem-20gr-i1525341192.html
"TINH CHẤT DƯỠNG DA COLLAGEN MEDICUBE GLOW BUBBLE SERUM 100ML - SẢN PHẨM ĐƯỢC YÊU THÍCH TRÊN THỊ TRƯỜNG, CHẤT LƯỢNG HÀNG ĐẦU, KHÁCH YÊU QUAN TÂM ỦNG HỘ SHOP NHÉ",749.900,,,Hồ Chí Minh,1,https://www.lazada.vn/products/tinh-chat-duong-da-collagen-medicube-glow-bubble-serum-100ml-san-pham-duoc-yeu-thich-tren-thi-truong-chat-luong-hang-dau-khach-yeu-quan-tam-ung-ho-shop-nhe-i2299373410.html
Thanh lăn tan bọng mắt SKIK - Kem dưỡng giảm thâm quầng đánh tan bọng mắt dưỡng da vùng mắt giảm nếp nhăn chân chim,69.000,,27,Hồ Chí Minh,4,https://www.lazada.vn/products/thanh-lan-tan-bong-mat-skik-kem-duong-giam-tham-quang-danh-tan-bong-mat-duong-da-vung-mat-giam-nep-nhan-chan-chim-i2228119124.html
Mặt Nạ Sủi Bọt Rau Má Dưỡng Trắng Da,29.000,,5,Hồ Chí Minh,2,https://www.lazada.vn/products/mat-na-sui-bot-rau-ma-duong-trang-da-i2094232339.html
"[cam kết chính hãng 100% ] Kem Face cho Da nhạy cảm Mocha - Herbal Luxury Face Cream 20gr Giúp dưỡng trắng Da dịu nhẹ, tái sinh Da, chống lão hóa Da, ..",120.000,,,Hồ Chí Minh,1,https://www.lazada.vn/products/cam-ket-chinh-hang-100-kem-face-cho-da-nhay-cam-mocha-herbal-luxury-face-cream-20gr-giup-duong-trang-da-diu-nhe-tai-sinh-da-chong-lao-hoa-da-i1227596245.html
Kem dưỡng da chống nắng Garnier Thái Lan Sakura White ban ngày,155.000,,,Hà Nội,1,https://www.lazada.vn/products/kem-duong-da-chong-nang-garnier-thai-lan-sakura-white-ban-ngay-i2030607442.html
[ CHÍNH HÃNG] Sữa rửa mặt làm trắng da ngừa mụn trẻ hóa kiềm dầu dưỡng ẩm sạch bụi bẩn Thích Hợp Mọi Loại Da,125.000,,16,Hà Nội,16,https://www.lazada.vn/products/chinh-hang-sua-rua-mat-lam-trang-da-ngua-mun-tre-hoa-kiem-dau-duong-am-sach-bui-ban-thich-hop-moi-loai-da-i1868889491.html
"Combo dưỡng da ngày- đêm dr sen (kem ngày :25gr,kem đêm :25gr)-mẫu mới",658.000,,,Bình Dương,2,https://www.lazada.vn/products/combo-duong-da-ngay-dem-dr-sen-kem-ngay-25grkem-dem-25gr-mau-moi-i1758529768.html
"Serum Vita C dưỡng ẩm, chăm sóc da",425.000,,,Hà Nội,2,https://www.lazada.vn/products/serum-vita-c-duong-am-cham-soc-da-i1292860464.html
"【Mua 2 tặng 1】Sữa rửa mặt 100ml làm sạch sâu cho nam giới và phụ nữ nhẹ nhàng kiểm soát dầu rửa mặt, dưỡng ẩm thu nhỏ lỗ chân lông chăm sóc da mặt",160.000,,,Hồ Chí Minh,2,https://www.lazada.vn/products/mua-2-tang-1sua-rua-mat-100ml-lam-sach-sau-cho-nam-gioi-va-phu-nu-nhe-nhang-kiem-soat-dau-rua-mat-duong-am-thu-nho-lo-chan-long-cham-soc-da-mat-i2203724943.html
Combo 3 món Sữa rửa mặt trà xanh 120ml + Serum 50ml + Kem face pháp 50g - GIúp dưỡng da trắng mịn tự nhiên,439.000,,6,Hồ Chí Minh,4,https://www.lazada.vn/products/combo-3-mon-sua-rua-mat-tra-xanh-120ml-serum-50ml-kem-face-phap-50g-giup-duong-da-trang-min-tu-nhien-i1540997163.html
Sữa rửa mặt Trà Xanh Innisfree 150g,69.000,,,Hà Nội,3,https://www.lazada.vn/products/sua-rua-mat-tra-xanh-innisfree-150g-i2328400684.html
Tinh Chất Dưỡng Trắng Da DEEP VITA C AMPOULE 30g,599.000,,,Hồ Chí Minh,1,https://www.lazada.vn/products/tinh-chat-duong-trang-da-deep-vita-c-ampoule-30g-i2143382369.html
"Kem Demejine Hàn Quốc ngày và đêm dưỡng trắng da, giảm mụn nám tàn nhang",99.000,,,Đăk Lăk,1,https://www.lazada.vn/products/kem-demejine-han-quoc-ngay-va-dem-duong-trang-da-giam-mun-nam-tan-nhang-i2156556768.html
"KEM DƯỠNG DA, NGỪA MỤN.KISSMI-N 10G.",35.000,,108,Hà Nội,8,https://www.lazada.vn/products/kem-duong-da-ngua-munkissmi-n-10g-i255677274.html
Hailicare collagen chống nhăn Sữa rửa mặt mờ dần nếp nhăn chống lão hóa dưỡng ẩm dùng cho mặt nhẹ nhàng làm sạch sâu và làm săn chắc bọt làm sạch 100g,49.900,,,Nước ngoài,1,https://www.lazada.vn/products/hailicare-collagen-chong-nhan-sua-rua-mat-mo-dan-nep-nhan-chong-lao-hoa-duong-am-dung-cho-mat-nhe-nhang-lam-sach-sau-va-lam-san-chac-bot-lam-sach-100g-i2604656492.html
KEM DƯỠNG TRẮNG DA G9 SKIN (dùng được cho cả NGÀY & ĐÊM),190.000,,108,Hồ Chí Minh,21,https://www.lazada.vn/products/kem-duong-trang-da-g9-skin-dung-duoc-cho-ca-ngay-dem-i211303120.html
"Nước Tẩy Trang Hatomugi Sạch Sâu Lỗ Chân Lông, Dưỡng Ẩm Và Làm Sáng Da",139.000,,,Hà Nội,1,https://www.lazada.vn/products/nuoc-tay-trang-hatomugi-sach-sau-lo-chan-long-duong-am-va-lam-sang-da-i2346633618.html
[Mẫu mới] Kem dưỡng tái tạo da Cicaplast B5+ 100ml,370.000,,10,Hà Nội,2,https://www.lazada.vn/products/mau-moi-kem-duong-tai-tao-da-cicaplast-b5-100ml-i1388776451.html
[MQSKIN] BÁN CHẠY KEM FACE DƯỠNG TRẮNG DA NHÂN SÂM MQ SKIN 30GR - MỸ PHẨM MQSKIN,249.999,,6,Hồ Chí Minh,5,https://www.lazada.vn/products/mqskin-ban-chay-kem-face-duong-trang-da-nhan-sam-mq-skin-30gr-my-pham-mqskin-i681342265.html
Kem Dưỡng Da VIBRANT GLAMOUR Chứa Retinol Tự Nhiên Chống Lão Hóa Xóa Mờ Nếp Nhăn Dưỡng Ẩm Nâng Cơ Chăm Sóc Da 80g,247.000,,,Hồ Chí Minh,1,https://www.lazada.vn/products/kem-duong-da-vibrant-glamour-chua-retinol-tu-nhien-chong-lao-hoa-xoa-mo-nep-nhan-duong-am-nang-co-cham-soc-da-80g-i2288809362.html
"Mặt Nạ Tái Sinh Cấp Ẩm Gigaherbs Dưỡng Trắng, Làm Đều Màu Da (10 mask/hộp)",129.000,,7,Hà Nội,4,https://www.lazada.vn/products/mat-na-tai-sinh-cap-am-gigaherbs-duong-trang-lam-deu-mau-da-10-maskhop-i2285643573.html
[Luvis]Kem face dưỡng da Tinh chất tổ yến Luvis Premium Swallow Nest Cream – Kem dưỡng tổ yến 30gr,249.999,,8,Hồ Chí Minh,3,https://www.lazada.vn/products/luviskem-face-duong-da-tinh-chat-to-yen-luvis-premium-swallow-nest-cream-kem-duong-to-yen-30gr-i629380355.html
Hyaluronic Acid Booster Serum Tinh chất dưỡng da siêu căng bóng 100ml,525.000,,9,Hà Nội,1,https://www.lazada.vn/products/hyaluronic-acid-booster-serum-tinh-chat-duong-da-sieu-cang-bong-100ml-i1830890820.html
"Sữa Rửa Mặt Làm Trắng Da, Ngừa Mụn IMAGES làm sạch sâu kiểm soát nhờn dưỡng ẩm trắng da giúp da sáng căng mướt sáng mịn",19.000,,,Hà Nội,1,https://www.lazada.vn/products/sua-rua-mat-lam-trang-da-ngua-mun-images-lam-sach-sau-kiem-soat-nhon-duong-am-trang-da-giup-da-sang-cang-muot-sang-min-i2089697717.html
Kem dưỡng collagen MEDICUBE TRIPPLE DEEP ERASING CREAM,565.000,,12,Hồ Chí Minh,1,https://www.lazada.vn/products/kem-duong-collagen-medicube-tripple-deep-erasing-cream-i2091826017.html
Toner Dr.Pepti Centella Toner Dưỡng Da Căng Bóng 180ml Chính Hãng Hàn Quốc,275.000,,62,Hồ Chí Minh,9,https://www.lazada.vn/products/toner-drpepti-centella-toner-duong-da-cang-bong-180ml-chinh-hang-han-quoc-i1593314345.html
Mặt Nạ Thạch Collagen Dưỡng Ẩm Chống Lão Hoá Meditime Real Collagen Mask -26g 4 Miếng - BABICO,180.000,,8,Long An,2,https://www.lazada.vn/products/mat-na-thach-collagen-duong-am-chong-lao-hoa-meditime-real-collagen-mask-26g-4-mieng-babico-i1312426402.html
"Sữa Rửa Mặt Cosrx Tạo Bọt Dịu Nhẹ Gel Rửa Mặt Dành Cho Da Mụn Ẩn, Da Nhạy Cảm 150ml",145.000,,5,Bắc Giang,4,https://www.lazada.vn/products/sua-rua-mat-cosrx-tao-bot-diu-nhe-gel-rua-mat-danh-cho-da-mun-an-da-nhay-cam-150ml-i2090456977.html
Mặt nạ trái cây BIOAQUA cấp ẩm dưỡng trắng ( mẫu ngẫu nhiên ) Viêt Mỹ Pharmacy,4.500,,96,Hà Nội,19,https://www.lazada.vn/products/mat-na-trai-cay-bioaqua-cap-am-duong-trang-mau-ngau-nhien-viet-my-pharmacy-i2360809610.html
TOP 1 SỮA RỬA MẶT SIMPLE GIÚP DƯỠNG ẨM CHO DA TRÔNG KHỎE VÀ MỊN MÀNG 150ML [CHÍNH HÃNG ĐỘC QUYỀN] [DIỆN MẠO MỚI],90.000,,,Hồ Chí Minh,1,https://www.lazada.vn/products/top-1-sua-rua-mat-simple-giup-duong-am-cho-da-trong-khoe-va-min-mang-150ml-chinh-hang-doc-quyen-dien-mao-moi-i2324407829.html
"IMAGES Mặt Nạ/ Giấy Chăm Sóc Da Toàn Diện Mask/Giấy Dưỡng Ẩm, Dưỡng Trắng Da Hàn Quốc 23g",29.999,,282,Hồ Chí Minh,96,https://www.lazada.vn/products/images-mat-na-giay-cham-soc-da-toan-dien-maskgiay-duong-am-duong-trang-da-han-quoc-23g-i2239271921.html
Thanh lăn Trà Xanh Mặt Nạ Trà Xanh Dưỡng Ẩm Giảm Mụn Đầu Đen 40g,25.000,,22,Hồ Chí Minh,5,https://www.lazada.vn/products/thanh-lan-tra-xanh-mat-na-tra-xanh-duong-am-giam-mun-dau-den-40g-i2173209917.html
(Rẻ nhất sàn) Mặt nạ ngủ mặt nạ dưỡng ẩm chăm sóc cấp ẩm cho da Sandinel Gold Deep Moisturizing Repair 120g,79.000,,,Long An,1,https://www.lazada.vn/products/re-nhat-san-mat-na-ngu-mat-na-duong-am-cham-soc-cap-am-cho-da-sandinel-gold-deep-moisturizing-repair-120g-i1881353883.html
"Aloe Vera làm dịu gel Mặt nạ dưỡng ẩm Aloe Vera Gel ,Aloe Jelly Skin Moisturizer cho khuôn mặt,Chiết xuất Aloe Vera tự nhiên Vitamin 30g",60.000,,714,Hồ Chí Minh,177,https://www.lazada.vn/products/aloe-vera-lam-diu-gel-mat-na-duong-am-aloe-vera-gel-aloe-jelly-skin-moisturizer-cho-khuon-matchiet-xuat-aloe-vera-tu-nhien-vitamin-30g-i2133337498.html
"MIEE ORGANIC 120g | Mặt nạ diếp cá tái sinh dưỡng trắng da, giảm thâm mụn, dưỡng ẩm, se khít lỗ chân lông",466.000,,65,Hà Nội,21,https://www.lazada.vn/products/miee-organic-120g-mat-na-diep-ca-tai-sinh-duong-trang-da-giam-tham-mun-duong-am-se-khit-lo-chan-long-i2254756002.html
"Sữa Rửa Mặt Sạch Sâu, Dưỡng Ẩm Cerave 236ml",139.000,,28,Hà Nội,26,https://www.lazada.vn/products/sua-rua-mat-sach-sau-duong-am-cerave-236ml-i2135915602.html
Tách Lẻ Miếng Ngọc Thật Massage Mặt Cạo Gió Ngọc Bích Masa Dùng Cho Spa Dưỡng Sinh. vvv,45.000,,25,Hà Nội,10,https://www.lazada.vn/products/tach-le-mieng-ngoc-that-massage-mat-cao-gio-ngoc-bich-masa-dung-cho-spa-duong-sinh-vvv-i2418220077.html
Serum The Ordinary Hyaluronic Acid 2% + B5 (30ml) Tinh Chất Phục Hồi Và Dưỡng ẩm Sâu,99.000,,50,Hà Nội,32,https://www.lazada.vn/products/serum-the-ordinary-hyaluronic-acid-2-b5-30ml-tinh-chat-phuc-hoi-va-duong-am-sau-i2130895393.html
Tinh chất dưỡng ẩm Cerave Hydrating Hyaluronic Acid Serum 30ml,145.000,,637,Hà Nội,90,https://www.lazada.vn/products/tinh-chat-duong-am-cerave-hydrating-hyaluronic-acid-serum-30ml-i2426076745.html
Máy Xông Hơi Da Mặt. Xịt Khoáng Nano Mini cầm tay- Siêu thẩm thấu và dưỡng ẩm da,39.000,,1.1K,Hồ Chí Minh,192,https://www.lazada.vn/products/may-xong-hoi-da-mat-xit-khoang-nano-mini-cam-tay-sieu-tham-thau-va-duong-am-da-i286290418.html
[YÊU THÍCH]Sữa Rửa Mặt Dưỡng Ẩm IMAGES Kiềm Dầuàm Sạch Sâu-COXITO,20.000,,6,Hà Nội,3,https://www.lazada.vn/products/yeu-thichsua-rua-mat-duong-am-images-kiem-dauam-sach-sau-coxito-i2089216002.html
[HCM][Lẻ 1] Đầu kim Nano tiêm dưỡng chất 30g 32g,7.000,,177,Hồ Chí Minh,9,https://www.lazada.vn/products/hcmle-1-dau-kim-nano-tiem-duong-chat-30g-32g-i978874511.html
"Sữa rửa mặt tạo bọt Làm sạch nhẹ nhàng Sữa rửa mặt axit amin Cân bằng dầu mỡ Làm sạch chuyên sâu, Soảng khoái nẩy da, Gải thiện mụn đầu đen , Dưỡng ẩm làm trắng,Da mẫn cảm cũng có thể sử dụng",99.000,,27,Hải Phòng,8,https://www.lazada.vn/products/sua-rua-mat-tao-bot-lam-sach-nhe-nhang-sua-rua-mat-axit-amin-can-bang-dau-mo-lam-sach-chuyen-sau-soang-khoai-nay-da-gai-thien-mun-dau-den-duong-am-lam-trangda-man-cam-cung-co-the-su-dung-i2135650476.html
Mặt nạ giấy dưỡng trắng da cấp ẩm thải độc HA Hyaluronic Acid - mặt nạ nội địa trung,1.999,,1.2K,Hà Nội,94,https://www.lazada.vn/products/mat-na-giay-duong-trang-da-cap-am-thai-doc-ha-hyaluronic-acid-mat-na-noi-dia-trung-i1980652013.html
"Xịt khoáng dưỡng ẩm, làm sáng da, xịt khoáng cấp nước làm dịu da, chống lão hóa, xịt khoáng nội địa Trung",20.000,,28,Hà Nội,8,https://www.lazada.vn/products/xit-khoang-duong-am-lam-sang-da-xit-khoang-cap-nuoc-lam-diu-da-chong-lao-hoa-xit-khoang-noi-dia-trung-i2210746662.html
